code;image_url;product_name;quantity;serving_size;packaging;brands;brands_tags;brand_owner;categories;categories_tags;labels;labels_tags;countries;countries_tags;ingredients_text_en;allergens;allergens_tags;nutrition_data_per;energy_kj_value;enerkj_unit;energy_kcal_value;energy_kcal_unit;fat_value;fat_unit;saturated_fat_value;saturated_fat_unit;carbohydrates_value;carbohydrates_unit;sugars_value;sugars_unit;fiber_value;fiber_unit;proteins_value;proteins_unit;salt_value;salt_unit;sodium_value;sodium_unit;energy_value;energy_unit;vitamin_c_value;vitamin_c_unit;vitamin_b6_value;vitamin_b6_unit;vitamin_b12_value;vitamin_b12_unit;potassium_value;potassium_unit;calcium_value;calcium_unit;caffeine_value;caffeine_unit;taurine_value;taurine_unit;food_groups_tags;nutriscore_grade
3,50211E+12;https://images.openfoodfacts.org/images/products/350/211/001/0056/front_fr.32.400.jpg;Lipton Green Ice Tea saveur pêche blanche 1 L;1000 ml;250 ml;Bouteille;Lipton;['lipton'];NULL;Boissons, Boissons édulcorées, Boissons au thé, Thés glacés;['en:beverages', 'en:artificially-sweetened-beverages', 'en:tea-based-beverages', 'en:iced-teas'];Point Vert;['en:green-dot'];France;['en:france'];NULL;;[];100g;43;kJ;10;kcal;0.5;g;0.1;g;02.apr;g;02.feb;g;NULL;NULL;0.5;g;0;g;0;g;43;kJ;NULL;NULL;NULL;NULL;NULL;NULL;NULL;NULL;NULL;NULL;NULL;NULL;NULL;NULL;['en:beverages', 'en:sweetened-beverages'];c
3,50211E+12;https://images.openfoodfacts.org/images/products/350/211/001/0810/front_fr.36.400.jpg;Lipton Green Ice Tea saveur citron vert menthe;500 ml;250 ml;Bouteille, Bouchon en plastique, Bouteille en plastique;Lipton;['lipton'];NULL;Beverages, Artificially sweetened beverages, Tea-based beverages, Sweetened beverages, en:iced-teas;['en:beverages', 'en:artificially-sweetened-beverages', 'en:tea-based-beverages', 'en:iced-teas', 'en:sweetened-beverages'];Point Vert;['en:green-dot'];France;['en:france'];NULL;;[];100g;43;kJ;10;kcal;0.5;g;0.1;g;02.mar;g;02.feb;g;NULL;NULL;0.5;g;0;g;0;g;43;kJ;NULL;NULL;NULL;NULL;NULL;NULL;NULL;NULL;NULL;NULL;NULL;NULL;NULL;NULL;['en:beverages', 'en:sweetened-beverages'];c
3,50211E+12;https://images.openfoodfacts.org/images/products/350/211/000/9081/front_fr.91.400.jpg;Lipton Ice Tea saveur Citron Citron Vert;1,5 L;250ml;Plastique, PET - Polytéréphtalate d'éthylène, Bouteille, Emballage plastique 100 % recyclé;Lipton,Unilever;['lipton', 'unilever'];NULL;Aliments et boissons à base de végétaux, Boissons, Boissons chaudes, Boissons à base de végétaux, Thés, Boissons sans alcool, Boissons au thé, Thés glacés, Thés glacés saveur citron, Boissons avec sucre ajouté;['en:plant-based-foods-and-beverages', 'en:beverages', 'en:hot-beverages', 'en:plant-based-beverages', 'en:teas', 'en:non-alcoholic-beverages', 'en:tea-based-beverages', 'en:iced-teas', 'en:lemon-flavored-iced-teas', 'en:sweetened-beverages'];Bouteille 100 %plastique recyclé, Thé noir Rainforest Alliance 100 % vérifiés;['fr:bouteille-100-plastique-recycle', 'fr:the-noir-rainforest-alliance-100-verifies'];France,La Réunion,Suisse,en:france;['en:france', 'en:reunion', 'en:switzerland'];NULL;;[];100g;80;kJ;19;kcal;0;g;0;g;04.iun;g;04.mai;g;0;g;0;g;0.01;g;0.004;g;80;kJ;NULL;NULL;NULL;NULL;NULL;NULL;NULL;NULL;NULL;NULL;NULL;NULL;NULL;NULL;['en:beverages', 'en:artificially-sweetened-beverages'];d
8,48E+12;https://images.openfoodfacts.org/images/products/848/000/027/8050/front_es.57.400.jpg;té limón 0;1,5 l;NULL;Plástico, PET, 5 L., Botella plastico de 1, Green dot;Hacendado;['hacendado'];NULL;Beverages, Artificially sweetened beverages, Diet beverages, Iced teas, Light iced teas, en:tea-based-beverages;['en:beverages', 'en:artificially-sweetened-beverages', 'en:diet-beverages', 'en:tea-based-beverages', 'en:iced-teas', 'en:light-iced-teas'];Low or no sugar,Green Dot,No preservatives,No sugar,With sweeteners;['en:low-or-no-sugar', 'en:green-dot', 'en:no-preservatives', 'en:no-sugar', 'en:with-sweeteners'];Spain;['en:spain'];water, acidulant (malic acid), tea extract 0,08%, acidity corrector (sodium citrates), sweeteners (sucralose, acesulfame k), aromas,;;[];100g;04.mar;kJ;1;kcal;0;g;0;g;0.09;g;0.09;g;0;g;0.01;g;0.05;g;0.02;g;04.mar;kJ;NULL;NULL;NULL;NULL;NULL;NULL;NULL;NULL;NULL;NULL;NULL;NULL;NULL;NULL;['en:beverages', 'en:teas-and-herbal-teas-and-coffees'];c
8,7227E+12;https://images.openfoodfacts.org/images/products/872/270/000/9276/front_fr.53.400.jpg;Lipton Ice Tea saveur pêche 25 cl;250 ml;250 ml;Plastique, Bouteille;Lipton;['lipton'];NULL;Aliments et boissons à base de végétaux, Boissons, Boissons à base de végétaux, Boissons au thé, Thés glacés, Thés glacés saveur pêche, Boissons avec sucre ajouté;['en:plant-based-foods-and-beverages', 'en:beverages', 'en:plant-based-beverages', 'en:tea-based-beverages', 'en:iced-teas', 'en:peach-flavored-iced-teas', 'en:sweetened-beverages'];Peu ou pas de sucre, Peu de sucre, Allégé en sucre, Moins 30% de sucre, Sans colorants, Sans conservateurs, Point Vert;['en:low-or-no-sugar', 'en:low-sugar', 'en:reduced-sugar', 'en:30-less-sugar', 'en:green-dot', 'en:no-colorings', 'en:no-preservatives'];France;['en:france'];NULL;;[];100g;82;kJ;19;kcal;0;g;0;g;04.iun;g;04.mai;g;NULL;NULL;0;g;0.025;g;0.01;g;82;kJ;NULL;NULL;NULL;NULL;NULL;NULL;NULL;NULL;NULL;NULL;NULL;NULL;NULL;NULL;['en:beverages', 'en:artificially-sweetened-beverages'];d
7,6168E+12;https://images.openfoodfacts.org/images/products/761/680/020/4086/front_de.60.400.jpg;Ice Tea;1l;250g;Bottle, Container, Tetra Pak;Migros,Bischofszell;['migros', 'bischofszell'];NULL;Aliments et boissons à base de végétaux,Boissons,Boissons chaudes,Boissons à base de végétaux,Thés,Boissons sans alcool,Boissons au thé,Thés glacés,Boissons avec sucre ajouté;['en:plant-based-foods-and-beverages', 'en:beverages', 'en:hot-beverages', 'en:plant-based-beverages', 'en:teas', 'en:non-alcoholic-beverages', 'en:tea-based-beverages', 'en:iced-teas', 'en:sweetened-beverages'];Agriculture durable,en:UTZ Certified;['en:sustainable-farming', 'en:utz-certified'];Frankreich, Schweiz, Germany;['en:france', 'en:germany', 'en:switzerland'];infusion of black tea and rose hips/carcade blossom (extract content: 1.2g/l), sugar, lemon juice from concentrate 2%;;[];100g;NULL;NULL;28;kcal;0.5;g;0;g;06.sept;g;06.sept;g;0;g;0;g;0;g;0;g;28;kcal;NULL;NULL;NULL;NULL;NULL;NULL;NULL;NULL;NULL;NULL;NULL;NULL;NULL;NULL;['en:beverages', 'en:sweetened-beverages'];d
26062648;https://images.openfoodfacts.org/images/products/26062648/front_fr.49.400.jpg;Thé glacé pêche;1,5L;NULL;;Fruima;['fruima'];NULL;Aliments et boissons à base de végétaux, Boissons, Boissons à base de végétaux, Boissons sans alcool, Boissons au thé, Thés glacés, Thés glacés saveur pêche;['en:plant-based-foods-and-beverages', 'en:beverages', 'en:plant-based-beverages', 'en:non-alcoholic-beverages', 'en:tea-based-beverages', 'en:iced-teas', 'en:peach-flavored-iced-teas'];;[];France;['en:france'];NULL;;[];100g;NULL;NULL;32;kcal;0.5;g;0;g;07.iul;g;07.iun;g;0;g;0.5;g;0.01;g;0.004;g;32;kcal;NULL;NULL;NULL;NULL;NULL;NULL;NULL;NULL;NULL;NULL;NULL;NULL;NULL;NULL;['en:beverages', 'en:sweetened-beverages'];e
9,0069E+12;https://images.openfoodfacts.org/images/products/900/690/001/4858/front_de.42.400.jpg;Grüner Tee;2l;NULL;84 C/PAP;Pfanner;['pfanner'];NULL;Boissons, Thés glacés;['en:beverages', 'en:iced-teas'];Végétarien, Végétalien;['en:vegetarian', 'en:vegan'];en:Germany;['en:germany'];NULL;;[];100g;111;kJ;26;kcal;0.5;g;0.1;g;06.feb;g;06.feb;g;0;g;0.5;g;0.01;g;0.004;g;111;kJ;NULL;NULL;NULL;NULL;NULL;NULL;NULL;NULL;NULL;NULL;NULL;NULL;NULL;NULL;['en:beverages', 'en:sweetened-beverages'];d
3,16893E+12;https://images.openfoodfacts.org/images/products/316/893/016/4463/front_fr.21.400.jpg;Pure Leaf Thé infusé glacé bio saveur pêche gourmande 1 L;1000 ml;250 ml;Bouteille, Bouchon en plastique, Bouteille en plastique;Pure leaf;['pure-leaf'];NULL;thé glacé;['en:beverages', 'en:iced-teas'];"Organic, EU Organic, FR-BIO-13, Green Dot, AB Agriculture Biologique

, en:eu-non-eu-agriculture";['en:organic', 'en:eu-organic', 'en:non-eu-agriculture', 'en:eu-agriculture', 'en:eu-non-eu-agriculture', 'en:fr-bio-13', 'en:green-dot', 'fr:ab-agriculture-biologique'];en:fr;['en:france'];NULL;;[];100g;80;kJ;19;kcal;0.5;g;0.1;g;04.iul;g;04.apr;g;NULL;NULL;0.5;g;0;g;0;g;80;kJ;NULL;NULL;NULL;NULL;NULL;NULL;NULL;NULL;NULL;NULL;NULL;NULL;NULL;NULL;['en:beverages', 'en:unsweetened-beverages'];d
3,16893E+12;https://images.openfoodfacts.org/images/products/316/893/016/5033/front_fr.26.400.jpg;Lipton Ice Tea saveur pêche touche de miel 1,5 L;1500 ml;250 ml;Plastique, Bouteille, Bouchon en plastique, Bouteille en plastique;Lipton;['lipton'];NULL;Boissons,Thés glacés,Thés glacés saveur pêche,Boissons avec sucre ajouté;['en:beverages', 'en:iced-teas', 'en:peach-flavored-iced-teas', 'en:sweetened-beverages'];Point Vert,Triman;['en:green-dot', 'fr:triman'];France;['en:france'];water,sugar,honey (0.6%),black tea extract⁽¹⁾ (1.2 g/l),natural flavors,acidifiers (citric acid, malic acid),antioxidant (ascorbic acid),⁽¹⁾ verified rainforest alliance, more information on ra,org, people and nature, human and nature,;;[];100g;70;kJ;17;kcal;0.5;g;0.1;g;4;g;03.sept;g;NULL;NULL;0.5;g;0;g;0;g;70;kJ;NULL;NULL;NULL;NULL;NULL;NULL;NULL;NULL;NULL;NULL;NULL;NULL;NULL;NULL;['en:beverages', 'en:sweetened-beverages'];d
5,449E+12;https://images.openfoodfacts.org/images/products/544/900/008/8550/front_en.12.400.jpg;Nestea sin azucar;;NULL;;Nestea;['nestea'];NULL;Beverages, Artificially sweetened beverages, Iced teas, en:tea-based-beverages;['en:beverages', 'en:artificially-sweetened-beverages', 'en:tea-based-beverages', 'en:iced-teas'];Contiene una fuente de fenilalanina;['en:contains-a-source-of-phenylalanine'];Francia,España;['en:france', 'en:spain'];;;[];100g;NULL;NULL;1;kcal;0;g;0;g;0;g;0;g;NULL;NULL;0;g;0.05;g;0.02;g;1;kcal;NULL;NULL;NULL;NULL;NULL;NULL;NULL;NULL;NULL;NULL;NULL;NULL;NULL;NULL;['en:beverages', 'en:teas-and-herbal-teas-and-coffees'];b
3,05764E+12;https://images.openfoodfacts.org/images/products/305/764/052/5568/front_fr.37.400.jpg;Infusion Bio saveur framboise;75 cl;NULL;;Volvic;['volvic'];NULL;Aliments et boissons à base de végétaux, Boissons, Boissons chaudes, Boissons à base de végétaux, Thés, Eaux, Infusions, Boissons sans alcool, Eaux aromatisées, Thés glacés;['en:plant-based-foods-and-beverages', 'en:beverages', 'en:hot-beverages', 'en:plant-based-beverages', 'en:teas', 'en:waters', 'en:herbal-teas', 'en:non-alcoholic-beverages', 'en:flavored-waters', 'en:iced-teas'];"Bio
";['en:organic'];France;['en:france'];NULL;;[];100g;NULL;NULL;10;kcal;0.5;g;0;g;02.mar;g;02.mar;g;NULL;NULL;0.5;g;0.01;g;0.004;g;10;kcal;NULL;NULL;NULL;NULL;NULL;NULL;NULL;NULL;NULL;NULL;NULL;NULL;NULL;NULL;['en:beverages', 'en:sweetened-beverages'];c
5,449E+12;https://images.openfoodfacts.org/images/products/544/900/029/5750/front_fr.14.400.jpg;FuzeTea Thé glacé pêche intense;7 x 250 ml;NULL;NULL;NULL;NULL;NULL;en:iced-teas;['en:beverages', 'en:iced-teas'];No colorings, en:no-preservatives;['en:no-colorings', 'en:no-preservatives'];France,France;['en:france'];NULL;;[];100g;NULL;NULL;19;kcal;0;g;0;g;04.mar;g;04.mar;g;0;g;0;g;0.03;g;0.012;g;19;kcal;NULL;NULL;NULL;NULL;NULL;NULL;NULL;NULL;NULL;NULL;NULL;NULL;NULL;NULL;['en:beverages', 'en:unsweetened-beverages'];d
5,449E+12;https://images.openfoodfacts.org/images/products/544/900/023/2489/front_fr.47.400.jpg;FuzeTea Thé vert glacé saveur mangue & camomille;400 ml;400g;Plastique, PET - Polytéréphtalate d'éthylène, Bouteille plastique, Point vert, nl:Tidyman wastebasket;Fuzetea,Coca cola;['fuzetea', 'coca-cola'];NULL;Aliments et boissons à base de végétaux, Boissons, Boissons à base de végétaux, Boissons édulcorées, Boissons au thé, Thés glacés, Boissons avec sucre ajouté;['en:plant-based-foods-and-beverages', 'en:beverages', 'en:plant-based-beverages', 'en:artificially-sweetened-beverages', 'en:tea-based-beverages', 'en:iced-teas', 'en:sweetened-beverages'];en:low-in-calories;['en:low-in-calories'];Belgique,France;['en:belgium', 'en:france'];water, sugar, concentrated mango juice (1%), acidifying: citric acid, sodium citrate, green tea extracts (0.14%), antioxidant: ascorbic acid, natural flavourings, sweetener: steviol glycosides, chamomile extracts;;[];100g;NULL;NULL;19;kcal;0;g;0;g;04.apr;g;04.mar;g;0;g;0;g;0.03;g;0.012;g;19;kcal;NULL;NULL;NULL;NULL;NULL;NULL;NULL;NULL;NULL;NULL;NULL;NULL;NULL;NULL;['en:beverages', 'en:sweetened-beverages'];d
3,12448E+12;https://images.openfoodfacts.org/images/products/312/448/018/9110/front_fr.100.400.jpg;May Tea mûre myrtille;1l;200 ml;Plastique, Bouteille, Bouteille et bouchon plastique à recycler;MAY TEA,ORANGINA SWCHEPPES;['may-tea', 'orangina-swcheppes'];NULL;Aliments et boissons à base de végétaux, Boissons, Boissons à base de végétaux, Boissons au thé, Thés glacés, Boissons avec sucre ajouté, Thés glacés saveur mûre;['en:plant-based-foods-and-beverages', 'en:beverages', 'en:plant-based-beverages', 'en:tea-based-beverages', 'en:iced-teas', 'en:sweetened-beverages', 'fr:thes-glaces-saveur-mure'];Sans arômes artificiels, Point Vert, Nouveau, Sans colorants, Sans conservateurs, Sans édulcorants, Tidy man;['en:no-artificial-flavors', 'en:green-dot', 'en:new', 'en:no-colorings', 'en:no-preservatives', 'en:without-sweeteners', 'fr:tidy-man'];Belgium,France;['en:belgium', 'en:france'];NULL;;[];100g;NULL;NULL;18;kcal;0;g;0;g;04.mar;g;04.mar;g;NULL;NULL;0;g;0.03;g;0.012;g;18;kcal;NULL;NULL;NULL;NULL;NULL;NULL;NULL;NULL;NULL;NULL;NULL;NULL;NULL;NULL;['en:beverages', 'en:sweetened-beverages'];d
8,48E+12;https://images.openfoodfacts.org/images/products/848/000/011/3078/front_es.39.400.jpg;Ice Tea Limón;;NULL;;Hacendado;['hacendado'];NULL;Plant-based foods and beverages, Beverages, Hot beverages, Plant-based beverages, Teas, Artificially sweetened beverages, Sweetened beverages, en:iced-teas;['en:plant-based-foods-and-beverages', 'en:beverages', 'en:hot-beverages', 'en:plant-based-beverages', 'en:teas', 'en:artificially-sweetened-beverages', 'en:iced-teas', 'en:sweetened-beverages'];Contiene una fuente de fenilalanina,Sin conservantes;['en:contains-a-source-of-phenylalanine', 'en:no-preservatives'];España;['en:spain'];NULL;;[];100g;NULL;NULL;11;kcal;0;g;0;g;02.iun;g;0;g;0;g;0;g;0.05;g;0.02;g;11;kcal;NULL;NULL;NULL;NULL;NULL;NULL;NULL;NULL;NULL;NULL;NULL;NULL;NULL;NULL;['en:beverages', 'en:sweetened-beverages'];c
6,13009E+11;https://images.openfoodfacts.org/images/products/061/300/873/0758/front_en.81.400.jpg;Pomegranate Green Tea;500 ml;500g;Bouchon plastique, Bouteille plastique, Stück;Arizona;['arizona'];NULL;Aliments et boissons à base de végétaux,Boissons,Boissons chaudes,Boissons à base de végétaux,Boissons aux fruits,Thés,Thés verts,Boissons sans alcool,Thés glacés,Boissons avec sucre ajouté,boisson au thé sucré avec édulcorants;['en:plant-based-foods-and-beverages', 'en:beverages', 'en:hot-beverages', 'en:plant-based-beverages', 'en:fruit-based-beverages', 'en:teas', 'en:green-teas', 'en:non-alcoholic-beverages', 'en:iced-teas', 'en:sweetened-beverages', 'fr:boisson-au-the-sucre-avec-edulcorants'];Hecho en Alemania,fr:Eco-emballages;['en:made-in-germany', 'fr:eco-emballages'];Austria,Bélgica,Francia,Suiza;['en:austria', 'en:belgium', 'en:france', 'en:switzerland'];apple juice from concentrate;;[];100g;NULL;NULL;21;kcal;0;g;0;g;5;g;04.sept;g;0;g;0;g;0;g;0;g;21;kcal;NULL;NULL;NULL;NULL;NULL;NULL;NULL;NULL;NULL;NULL;NULL;NULL;NULL;NULL;['en:beverages', 'en:artificially-sweetened-beverages'];d
3,50211E+12;https://images.openfoodfacts.org/images/products/350/211/000/6851/front_fr.63.400.jpg;Lipton Ice Tea duo saveur pêche abricot 1,5 L;1500 ml;250 ml;Plastique, Bouteille, Carton;Lipton;['lipton'];NULL;Aliments et boissons à base de végétaux, Boissons, Boissons à base de végétaux, Boissons édulcorées, Boissons au thé, Thés glacés, Boissons avec sucre ajouté;['en:plant-based-foods-and-beverages', 'en:beverages', 'en:plant-based-beverages', 'en:artificially-sweetened-beverages', 'en:tea-based-beverages', 'en:iced-teas', 'en:sweetened-beverages'];Peu ou pas de sucre, Peu de sucre, Allégé en sucre, Point Vert, Sans colorants, Sans conservateurs, 30 % moins sucré que la plupart des sodas hors light;['en:low-or-no-sugar', 'en:low-sugar', 'en:reduced-sugar', 'en:green-dot', 'en:no-colorings', 'en:no-preservatives', 'fr:30-moins-sucre-que-la-plupart-des-sodas-hors-light'];France;['en:france'];NULL;;[];100g;81;kJ;19;kcal;0;g;0;g;04.iun;g;04.mai;g;0;g;0;g;0.02;g;0.008;g;81;kJ;NULL;NULL;NULL;NULL;NULL;NULL;NULL;NULL;NULL;NULL;NULL;NULL;NULL;NULL;['en:beverages', 'en:sweetened-beverages'];d
5,449E+12;https://images.openfoodfacts.org/images/products/544/900/002/0864/front_fr.9.400.jpg;Refresco de té negro con limón sin azúcar sin calorías;1;NULL;;Nestea;['nestea'];NULL;Boissons, Thés glacés;['en:beverages', 'en:iced-teas'];;[];Francia,España,Reino Unido;['en:france', 'en:spain', 'en:united-kingdom'];NULL;;[];100g;NULL;NULL;1;kcal;0;g;0;g;0;g;0;g;0;g;0;g;0.05;g;0.02;g;1;kcal;NULL;NULL;NULL;NULL;NULL;NULL;NULL;NULL;NULL;NULL;NULL;NULL;NULL;NULL;['en:beverages', 'en:artificially-sweetened-beverages'];b
3,16893E+12;https://images.openfoodfacts.org/images/products/316/893/016/4401/front_fr.29.400.jpg;Pure Leaf Thé infusé glacé bio saveur menthe fraîche 1 L;1000 ml;250 ml;Bouteille, Bouteille en plastique;Pure leaf;['pure-leaf'];NULL;Boissons,Thés glacés;['en:beverages', 'en:iced-teas'];"Organic, EU Organic, FR-BIO-13, Green Dot
, en:eu-non-eu-agriculture";['en:organic', 'en:eu-organic', 'en:non-eu-agriculture', 'en:eu-agriculture', 'en:eu-non-eu-agriculture', 'en:fr-bio-13', 'en:green-dot'];France;['en:france'];Thé vert infusé (95%), sucre, acidifiant (acide citrique), antioxydant (acide ascorbique), stabilisant (pectine), arômes naturel de menthe;;[];100g;80;kJ;19;kcal;0.5;g;0.1;g;04.mai;g;04.mai;g;NULL;NULL;0.2;g;0;g;0;g;80;kJ;NULL;NULL;NULL;NULL;NULL;NULL;NULL;NULL;NULL;NULL;NULL;NULL;NULL;NULL;['en:beverages', 'en:unsweetened-beverages'];d
5,449E+12;https://images.openfoodfacts.org/images/products/544/900/023/7620/front_fr.22.400.jpg;Black tea - Peach Hibiscus;25cl;100ml;25cl;FUZE TEA;['fuze-tea'];NULL;Beverages, Artificially sweetened beverages, Tea-based beverages, Iced teas, Sweetened beverages, en:teas;['en:plant-based-foods-and-beverages', 'en:beverages', 'en:hot-beverages', 'en:plant-based-beverages', 'en:teas', 'en:artificially-sweetened-beverages', 'en:tea-based-beverages', 'en:iced-teas', 'en:sweetened-beverages'];;[];France, en:belgium;['en:belgium', 'en:france'];NULL;;[];100g;198;kj;19;kcal;0;g;0;g;04.mar;g;04.mar;g;NULL;NULL;0;g;0.025;g;0.01;g;198;kj;NULL;NULL;NULL;NULL;NULL;NULL;NULL;NULL;NULL;NULL;NULL;NULL;NULL;NULL;['en:beverages', 'en:sweetened-beverages'];e
3,12448E+12;https://images.openfoodfacts.org/images/products/312/448/018/9158/front_fr.52.400.jpg;Thé vert infusé glacé parfum yuzu agrumes;1 l;200 ml;Plastique, Bouteille;May tea;['may-tea'];NULL;Boissons, Thés glacés;['en:beverages', 'en:iced-teas'];Sans arômes artificiels, Sans colorants, Sans conservateurs;['en:no-artificial-flavors', 'en:no-colorings', 'en:no-preservatives'];Belgique,France;['en:belgium', 'en:france'];NULL;;[];100g;68;kJ;16;kcal;0;g;0;g;03.iun;g;03.mai;g;NULL;NULL;0;g;0.03;g;0.012;g;68;kJ;NULL;NULL;NULL;NULL;NULL;NULL;NULL;NULL;NULL;NULL;NULL;NULL;NULL;NULL;['en:beverages', 'en:sweetened-beverages'];d
9,0069E+12;https://images.openfoodfacts.org/images/products/900/690/001/1529/front_de.53.400.jpg;Ice Tea Pfirsich;2 l;2l;Tetra Pak;Pfanner;['pfanner'];NULL;Pflanzliche Lebensmittel und Getränke, Getränke, Pflanzliche Getränke, Alkoholfreie Getränke, Teegetränke, Eistees, Gezuckerte Getränke;['en:plant-based-foods-and-beverages', 'en:beverages', 'en:plant-based-beverages', 'en:non-alcoholic-beverages', 'en:tea-based-beverages', 'en:iced-teas', 'en:sweetened-beverages'];Vegetarisch,Vegan,FSC Mix;['en:vegetarian', 'en:vegan', 'en:fsc', 'en:fsc-mix'];France,Allemagne,Norvège,Suède;['en:france', 'en:germany', 'en:norway', 'en:sweden'];infusion of black tea, rosehip and hibiscus flower (water, black tea, rosehip, hibiscus flower), sugar, peach juice (1%) from peach juice concentrate, acidifier citric acid, flavouring;;[];100g;NULL;NULL;25;kcal;0.5;g;0.1;g;06.feb;g;06.feb;g;NULL;NULL;0.5;g;0.01;g;0.004;g;25;kcal;NULL;NULL;NULL;NULL;NULL;NULL;NULL;NULL;NULL;NULL;NULL;NULL;NULL;NULL;['en:beverages', 'en:sweetened-beverages'];d
3,16893E+12;https://images.openfoodfacts.org/images/products/316/893/015/8332/front_fr.18.400.jpg;Pure Leaf Thé infusé glacé bio saveur pêche de Méditerranée 1 L;1000 ml;250 ml;Bouteille plastique;Pure leaf;['pure-leaf'];NULL;Boissons, Boissons sans alcool, Thés glacés;['en:beverages', 'en:non-alcoholic-beverages', 'en:iced-teas'];"Bio, Bio européen, Point Vert, AB Agriculture Biologique


";['en:organic', 'en:eu-organic', 'en:green-dot', 'fr:ab-agriculture-biologique'];France,États-Unis;['en:france', 'en:united-states'];NULL;;[];100g;79;kJ;19;kcal;0.5;g;0.1;g;04.iun;g;04.apr;g;NULL;NULL;0.5;g;0.01;g;0.004;g;79;kJ;NULL;NULL;NULL;NULL;NULL;NULL;NULL;NULL;NULL;NULL;NULL;NULL;NULL;NULL;['en:beverages', 'en:unsweetened-beverages'];d
