code;image_url;product_name;quantity;serving_size;packaging;brands;brands_tags;brand_owner;categories;categories_tags;labels;labels_tags;countries;countries_tags;ingredients_text_en;allergens;allergens_tags;nutrition_data_per;energy_kj_value;enerkj_unit;energy_kcal_value;energy_kcal_unit;fat_value;fat_unit;saturated_fat_value;saturated_fat_unit;carbohydrates_value;carbohydrates_unit;sugars_value;sugars_unit;fiber_value;fiber_unit;proteins_value;proteins_unit;salt_value;salt_unit;sodium_value;sodium_unit;energy_value;energy_unit;vitamin_c_value;vitamin_c_unit;vitamin_b6_value;vitamin_b6_unit;vitamin_b12_value;vitamin_b12_unit;potassium_value;potassium_unit;calcium_value;calcium_unit;caffeine_value;caffeine_unit;taurine_value;taurine_unit;food_groups_tags;nutriscore_grade
3,03371E+12;https://images.openfoodfacts.org/images/products/303/371/007/1005/front_fr.190.400.jpg;RICORE au Lait, Café & Chicorée, Boîte 400g;400 g;168.8g;Métal, Plastique, Boîte, Boîte de conserve ou canette, Canette, Acier, Boîte en métal;Nestlé, Ricore;['nestle', 'ricore'];NULL;Beverages, it:caffè solubile, en:instant-chicory;['en:plant-based-foods-and-beverages', 'en:beverages', 'en:plant-based-beverages', 'en:instant-beverages', 'en:instant-chicory', 'it:caffe-solubile'];Green Dot, Made in France, Nutriscore, fr:Triman, en:nutriscore-grade-a;['en:green-dot', 'en:made-in-france', 'en:nutriscore', 'en:nutriscore-grade-a', 'fr:triman'];France,La Réunion,Suisse;['en:france', 'en:reunion', 'en:switzerland'];NULL;en:milk;['en:milk'];100g;1818;kJ;434;kcal;15.mai;g;09.iun;g;53;g;39;g;11;g;15;g;1;g;0.4;g;1818;kJ;NULL;NULL;NULL;NULL;NULL;NULL;NULL;NULL;530;mg;NULL;NULL;NULL;NULL;[];e
3,06714E+12;https://images.openfoodfacts.org/images/products/306/714/001/3120/front_fr.154.400.jpg;Chicorée soluble nature;200 g;5 g;Verre,Opercule,Couvercle plastique;LEROUX;['leroux'];NULL;Aliments et boissons à base de végétaux,Boissons,Aliments d'origine végétale,Petit-déjeuners,Boissons chaudes,Boissons à base de végétaux,Cafés,Boissons instantanées,Chicorée soluble,Chicorée;['en:plant-based-foods-and-beverages', 'en:beverages', 'en:plant-based-foods', 'en:breakfasts', 'en:hot-beverages', 'en:plant-based-beverages', 'en:coffees', 'en:instant-beverages', 'en:instant-chicory', 'fr:chicoree'];Sans gluten,Source de fibres alimentaires,Riche en fibres,Sans caféine;['en:no-gluten', 'en:source-of-fibre', 'en:high-fibres', 'en:no-caffeine'];France,Espagne;['en:france', 'en:spain'];100% soluble chicory;;[];100g;1327;kJ;316;kcal;01.ian;g;0.5;g;57;g;26;g;32;g;03.iun;g;0.38;g;0.152;g;1327;kJ;NULL;NULL;NULL;NULL;NULL;NULL;NULL;NULL;NULL;NULL;NULL;NULL;NULL;NULL;[];e
5,41119E+12;https://images.openfoodfacts.org/images/products/541/118/811/5366/front_en.118.400.jpg;Avena;1l;NULL;HDPE 2,C/PAP 84;Alpro;['alpro'];NULL;Plant-based foods and beverages,Beverages,Plant-based foods,Cereals and potatoes,Cereals and their products,Plant-based beverages,Milk substitute,Plant milks,Cereal milks,Oat milks,Unsweetened beverages;['en:plant-based-foods-and-beverages', 'en:beverages', 'en:plant-based-foods', 'en:cereals-and-potatoes', 'en:cereals-and-their-products', 'en:plant-based-beverages', 'en:milk-substitute', 'en:plant-milks', 'en:cereal-milks', 'en:oat-milks', 'en:unsweetened-beverages'];Low or no fat,Low fat,Vegetarian,Source of fibre,Vegan,100% vegetable,Calcium source,Do not freeze,FSC,FSC Mix,Green Dot,High fibres,Made in the EU,No added sugar,No colorings,No lactose,No preservatives,The Vegan Society,Vitamin B12 source,Vitamin D source,Without addition of dairy products,Vitamin-b2-source;['en:low-or-no-fat', 'en:low-fat', 'en:vegetarian', 'en:source-of-fibre', 'en:vegan', 'en:100-vegetable', 'en:calcium-source', 'en:do-not-freeze', 'en:fsc', 'en:fsc-mix', 'en:green-dot', 'en:high-fibres', 'en:made-in-the-eu', 'en:no-added-sugar', 'en:no-colorings', 'en:no-lactose', 'en:no-preservatives', 'en:the-vegan-society', 'en:vitamin-b12-source', 'en:vitamin-d-source', 'en:without-addition-of-dairy-products', 'en:vitamin-b2-source'];Belgium,Czech Republic,France,Germany,Italy,Portugal,United Kingdom;['en:belgium', 'en:czech-republic', 'en:france', 'en:germany', 'en:italy', 'en:portugal', 'en:united-kingdom'];oat  base (water,  oat  9,8%), soluble corn fibre, sunflower oil, calcium (tri-calcium phosphate), sea salt, stabiliser (gellan gum), vitamins (b2, b12, d2),;en:gluten;['en:gluten'];100g;192;kJ;46;kcal;01.mai;g;0.1;g;07.feb;g;03.mar;g;01.mai;g;0.3;g;0.09;g;0.036;g;192;kJ;NULL;NULL;NULL;NULL;0.38;mg;NULL;NULL;120;mg;NULL;NULL;NULL;NULL;['en:beverages', 'en:plant-based-milk-substitutes'];a
8,42335E+12;https://images.openfoodfacts.org/images/products/842/335/286/1402/front_en.45.400.jpg;Bebida de avena;1 l;200ml;Tetra Brik;ALITEY;['alitey'];NULL;Alimentos y bebidas de origen vegetal,Bebidas,Alimentos de origen vegetal,Cereales y patatas,Cereales y derivados,Bebidas de origen vegetal,Sustitutos de la leche,Bebidas vegetales,Bebidas de cereales,Bebidas de avena,Bebidas no azucaradas;['en:plant-based-foods-and-beverages', 'en:beverages', 'en:plant-based-foods', 'en:cereals-and-potatoes', 'en:cereals-and-their-products', 'en:plant-based-beverages', 'en:milk-substitute', 'en:plant-milks', 'en:cereal-milks', 'en:oat-milks', 'en:unsweetened-beverages'];Bajo o sin azúcar,100% vegetal,Sin azúcares añadidos,Sin lactosa,Baja-en-grasas-saturadas,Bajo-contenido-en-sal;['en:low-or-no-sugar', 'en:100-vegetable', 'en:no-added-sugar', 'en:no-lactose', 'es:baja-en-grasas-saturadas', 'es:bajo-contenido-en-sal'];España;['en:spain'];water, oatmeal (15%);es:Avena;['es:avena'];100g;186;kJ;46;kcal;0.8;g;0.2;g;08.ian;g;05.apr;g;0.4;g;01.apr;g;0.04;g;0.016;g;186;kJ;NULL;NULL;NULL;NULL;NULL;NULL;NULL;NULL;NULL;NULL;NULL;NULL;NULL;NULL;['en:beverages', 'en:plant-based-milk-substitutes'];b
3,25469E+12;https://images.openfoodfacts.org/images/products/325/469/158/6085/front_fr.95.400.jpg;Le Bio Orange;1.5 L;NULL;Brique, Frais, Brique carton et son bouchon à recycler, FSC mixte, Point vert, Triman, nl:Tetra Gemina Aseptic;Pressade;['pressade'];NULL;Aliments et boissons à base de végétaux, Boissons, Boissons à base de végétaux, Boissons aux fruits, Jus et nectars, Nectars de fruits, Jus de fruits, Boissons sans alcool, Nectars d'orange;['en:plant-based-foods-and-beverages', 'en:beverages', 'en:plant-based-beverages', 'en:fruit-based-beverages', 'en:juices-and-nectars', 'en:fruit-nectars', 'en:fruit-juices', 'en:non-alcoholic-beverages', 'en:orange-nectars'];"Bio, Bio européen, AB Agriculture Biologique, Agriculture UE/Non UE, FR-BIO-01


";['en:organic', 'en:eu-organic', 'en:non-eu-agriculture', 'en:eu-agriculture', 'en:eu-non-eu-agriculture', 'en:fr-bio-01', 'fr:ab-agriculture-biologique'];France;['en:france'];NULL;;[];100g;144;kJ;34;kcal;NULL;NULL;NULL;NULL;08.feb;g;08.feb;g;0.5;g;0.5;g;0;g;0;g;144;kJ;NULL;NULL;NULL;NULL;NULL;NULL;NULL;NULL;NULL;NULL;NULL;NULL;NULL;NULL;['en:beverages', 'en:sweetened-beverages'];NULL
5,03886E+12;https://images.openfoodfacts.org/images/products/503/886/216/2500/front_fr.119.400.jpg;100% oranges sans pulpe;900 ml;150ml;Plastic, Bottle, fr:Bouteille en plastique à recycler, fr:Bouchon à recycler;innocent;['innocent'];NULL;Refrigerated squeezed orange juices;['en:plant-based-foods-and-beverages', 'en:beverages', 'en:plant-based-beverages', 'en:fruit-based-beverages', 'en:juices-and-nectars', 'en:fruit-juices', 'en:orange-juices', 'en:refrigerated-squeezed-juices', 'en:refrigerated-squeezed-orange-juices'];Peu ou pas de sucre,en:fsc,FSC Mix,Sans sucre ajouté,en:fsc-c095196,Végétalien;['en:low-or-no-sugar', 'en:vegetarian', 'en:vegan', 'en:fsc', 'en:fsc-mix', 'en:no-added-sugar', 'en:fsc-c095196'];France,Switzerland;['en:france', 'en:switzerland'];NULL;;[];100g;149;kJ;35;kcal;0.5;g;0.1;g;07.aug;g;07.aug;g;0.7;g;0.7;g;0.01;g;0.004;g;149;kJ;33;mg;NULL;NULL;NULL;NULL;NULL;NULL;NULL;NULL;NULL;NULL;NULL;NULL;['en:beverages', 'en:unsweetened-beverages'];e
3,25469E+12;https://images.openfoodfacts.org/images/products/325/469/158/6115/front_fr.59.400.jpg;Nectar de pommes - Doux - Bio;1,5 l;100ml;Tetra Pak, Brick, Cardboard, fr:Brique en carton;Pressade;['pressade'];NULL;Aliments et boissons à base de végétaux, Boissons, Boissons à base de végétaux, Boissons aux fruits, Jus et nectars, Nectars de fruits, Nectars de pomme, Boissons sans alcool;['en:plant-based-foods-and-beverages', 'en:beverages', 'en:plant-based-beverages', 'en:fruit-based-beverages', 'en:juices-and-nectars', 'en:fruit-nectars', 'en:apple-nectars', 'en:non-alcoholic-beverages'];"Bio, Bio européen, AB Agriculture Biologique, FR-BIO-01


";['en:organic', 'en:eu-organic', 'en:fr-bio-01', 'fr:ab-agriculture-biologique'];France;['en:france'];NULL;;[];100g;NULL;NULL;35;kcal;0;g;0;g;08.aug;g;08.aug;g;0.5;g;0.5;g;0;g;0;g;35;kcal;NULL;NULL;NULL;NULL;NULL;NULL;NULL;NULL;NULL;NULL;NULL;NULL;NULL;NULL;['en:beverages', 'en:sweetened-beverages'];d
3,12448E+12;https://images.openfoodfacts.org/images/products/312/448/018/6560/front_fr.120.400.jpg;Oasis tropical;33 cl;100ml;Métal,Boîte de conserve ou canette,Canette,Acier;Oasis;['oasis'];NULL;Boissons,Boissons sans alcool,Sodas,Sodas aux fruits;['en:plant-based-foods-and-beverages', 'en:beverages', 'en:plant-based-beverages', 'en:carbonated-drinks', 'en:fruit-based-beverages', 'en:sodas', 'en:fruit-sodas', 'en:non-alcoholic-beverages'];en:Sans conservateurs;['en:sans-conservateurs'];France,en:Belgique,en:Suisse;['en:france', 'en:belgique', 'en:suisse'];spring water 80%, fruit juice based on concentrates 12% (orange 6.4%, apple 5.5%, passion fruit 0.1%, mango 0.07%), sugar, acidifier: citric acid, aroma, antioxidant: ascorbic acid, stabilizer: acacia gum, color: paprika extract,;;[];100g;141;kJ;33;kcal;0;g;0;g;07.sept;g;07.aug;g;NULL;NULL;0.1;g;0;g;0;g;141;kJ;NULL;NULL;NULL;NULL;NULL;NULL;NULL;NULL;NULL;NULL;NULL;NULL;NULL;NULL;['en:beverages', 'en:sweetened-beverages'];e
5,449E+12;https://images.openfoodfacts.org/images/products/544/900/001/1527/front_fr.49.400.jpg;Fanta orange;330 ml;330ml;Metal,Can,Drink can,Aluminium-can,Green dot;Fanta;['fanta'];NULL;Plant-based foods and beverages,Beverages,Plant-based beverages,Carbonated drinks,Fruit-based beverages,Sodas,Fruit sodas,Orange soft drinks;['en:plant-based-foods-and-beverages', 'en:beverages', 'en:plant-based-beverages', 'en:carbonated-drinks', 'en:fruit-based-beverages', 'en:sodas', 'en:fruit-sodas', 'en:orange-soft-drinks'];Contains a source of phenylalanine,Green Dot,With sweeteners;['en:contains-a-source-of-phenylalanine', 'en:green-dot', 'en:with-sweeteners'];Benin;['en:benin'];carbonated water: concentrated orange juice (10%): sugar: concentrated lemon juice (2%): natural orange aromas with other natural aromas: preservative: potassium sorbate: stabilizing guar gum: honey extracts coloring: carotenoids,;;[];100g;157;kJ;37;kcal;0;g;0;g;9;g;9;g;0;g;0;g;0;g;0;g;157;kJ;NULL;NULL;NULL;NULL;NULL;NULL;NULL;NULL;NULL;NULL;NULL;NULL;NULL;NULL;['en:alcoholic-beverages'];e
3,04532E+12;https://images.openfoodfacts.org/images/products/304/532/010/4127/front_fr.149.400.jpg;jus orange;1 l;NULL;Plastique, Bouteille, Flacon PET;Andros;['andros'];NULL;Aliments et boissons à base de végétaux, Boissons, Boissons à base de végétaux, Boissons aux fruits, Jus et nectars, Jus de fruits, Jus d'orange, Jus de fruits pur jus, Jus d'orange pur jus;['en:plant-based-foods-and-beverages', 'en:beverages', 'en:plant-based-beverages', 'en:fruit-based-beverages', 'en:juices-and-nectars', 'en:fruit-juices', 'en:orange-juices', 'en:squeezed-juices', 'en:squeezed-orange-juices'];Sans sucre ajouté, en:Sans colorants, en:Sans conservateurs;['en:no-added-sugar', 'en:sans-colorants', 'en:sans-conservateurs'];France,Belgium,Switzerland;['en:belgium', 'en:france', 'en:switzerland'];orange juice;;[];100g;173;kJ;41;kcal;0.1;g;0;g;09.ian;g;09.ian;g;0.6;g;0.6;g;0;g;0;g;173;kJ;35;mg;NULL;NULL;NULL;NULL;NULL;NULL;NULL;NULL;NULL;NULL;NULL;NULL;['en:beverages', 'en:unsweetened-beverages'];c
3,12448E+12;https://images.openfoodfacts.org/images/products/312/448/000/2501/front.5.400.jpg;Schweppes Agrumes;1,5 l;200ml;Plastic, Bottle, fr:Bouchon en plastique, fr:Bouteille en plastique;Schweppes;['schweppes'];NULL;Plant-based foods and beverages, Beverages, Plant-based beverages, Carbonated drinks, Fruit-based beverages, Artificially sweetened beverages, Sodas, Diet beverages, Fruit sodas, Diet sodas, Light fruit sodas, en:sweetened-beverages;['en:plant-based-foods-and-beverages', 'en:beverages', 'en:plant-based-beverages', 'en:carbonated-drinks', 'en:fruit-based-beverages', 'en:artificially-sweetened-beverages', 'en:sodas', 'en:diet-beverages', 'en:fruit-sodas', 'en:diet-sodas', 'en:light-fruit-sodas', 'en:sweetened-beverages'];Avec édulcorants;['en:avec-edulcorants'];France,Belgium;['en:belgium', 'en:france'];carbonated water, sugar, natural orange extracts, acidifier: citric acid, preservative: e202, sweeteners: acesulfame k and sucralose, modified starch, antioxidant: ascorbic acid, natural citrus aromas with other natural aromas, stabilizing: e445, dye: e142,;;[];100g;NULL;NULL;24;kcal;0;g;0;g;05.iul;g;05.iul;g;NULL;NULL;0;g;0.01;g;0.004;g;24;kcal;NULL;NULL;NULL;NULL;NULL;NULL;NULL;NULL;NULL;NULL;NULL;NULL;NULL;NULL;['en:beverages', 'en:sweetened-beverages'];d
3,22982E+12;https://images.openfoodfacts.org/images/products/322/982/012/9112/front_fr.176.400.jpg;Amande intense;1 L;NULL;Plastique, Tetra Pak, Brique, Carton, Brique carton et son boucho à recycler, Brique en carton, Tetra Brik Aseptic;Bjorg;['bjorg'];NULL;Sweetened natural almond milks;['en:plant-based-foods-and-beverages', 'en:beverages', 'en:plant-based-foods', 'en:nuts-and-their-products', 'en:plant-based-beverages', 'en:milk-substitute', 'en:plant-milks', 'en:nut-milks', 'en:almond-milks', 'en:sweetened-natural-almond-milks'];Organic,EU Organic,Non-EU Agriculture,ES-ECO-019-CT,ES-ECO-020-CV,EU Agriculture,EU/non-EU Agriculture,FSC,FSC Mix,IT-BIO-006,IT-BIO-007,Made in Spain,Nutriscore,Nutriscore Grade B,AB Agriculture Biologique,Fsc-c014047,fr:Comité Agricultura Ecologica;['en:organic', 'en:eu-organic', 'en:non-eu-agriculture', 'en:es-eco-019-ct', 'en:es-eco-020-cv', 'en:eu-agriculture', 'en:eu-non-eu-agriculture', 'en:fsc', 'en:fsc-mix', 'en:it-bio-006', 'en:it-bio-007', 'en:made-in-spain', 'en:nutriscore', 'en:nutriscore-grade-b', 'fr:ab-agriculture-biologique', 'en:fsc-c014047', 'fr:comite-agricultura-ecologica'];France,Martinique,Réunion;['en:france', 'en:martinique', 'en:reunion'];;en:nuts;['en:nuts'];100g;NULL;NULL;61;kcal;4;g;0.4;g;04.mai;g;4;g;0.9;g;01.feb;g;0.09;g;0.036;g;61;kcal;NULL;NULL;NULL;NULL;NULL;NULL;NULL;NULL;120;mg;NULL;NULL;NULL;NULL;['en:beverages', 'en:plant-based-milk-substitutes'];b
3,22982E+12;https://images.openfoodfacts.org/images/products/322/982/078/4946/front_en.78.400.jpg;Lait d'amande chocolat;1 L;NULL;Plastic, Bottle cap, Brick, Container, fr:Bouchon en plastique, fr:Brique en carton;Bjorg;['bjorg'];NULL;Alimentos y bebidas de origen vegetal,Bebidas,Alimentos de origen vegetal,Frutos de cáscara y derivados,Bebidas de origen vegetal,Sustitutos de la leche,Bebidas vegetales,Bebidas no alcohólicas,Leches de frutos de cáscara,Leches de almendras,en:Chocolate almond milks,Bebidas azucaradas,Bebidas no azucaradas;['en:plant-based-foods-and-beverages', 'en:beverages', 'en:plant-based-foods', 'en:nuts-and-their-products', 'en:plant-based-beverages', 'en:milk-substitute', 'en:plant-milks', 'en:non-alcoholic-beverages', 'en:nut-milks', 'en:almond-milks', 'en:chocolate-almond-milks', 'en:sweetened-beverages', 'en:unsweetened-beverages'];Ecológico,Certificado por Ecocert,Ecológico UE,Agricultura no UE,100% vegetal,Agricultura UE,Agricultura UE/no UE,FSC,FSC Mixto,Punto Verde,IT-BIO-007,Fabricado en Italia,Nutriscore,Nutriscore B,AB Agriculture Biologique,fr:Triman,fr:ecocert-france;['en:organic', 'en:certified-by-ecocert', 'en:eu-organic', 'en:non-eu-agriculture', 'en:100-vegetable', 'en:eu-agriculture', 'en:eu-non-eu-agriculture', 'en:fsc', 'en:fsc-mix', 'en:green-dot', 'en:it-bio-007', 'en:made-in-italy', 'en:nutriscore', 'en:nutriscore-grade-b', 'fr:ab-agriculture-biologique', 'fr:triman', 'fr:ecocert-france'];Francia,Martinica,España;['en:france', 'en:martinique', 'en:spain'];water, red cane sugar*, almond* (2,67%), rice starch*, cocoa low fat powder*, chocolate' (1%) (cocoa paste*, red cane sugar*, cocoa butter*), seaweed lithothamnium calcareum (0,47%), thickener: seed flour of carob, sea salt, 95,9% of ingredients of agricultural origin were obtained according to the rules of organic production,;en:nuts;['en:nuts'];100g;NULL;NULL;60;kcal;02.ian;g;0.5;g;09.ian;g;7;g;0.7;g;0.7;g;0.08;g;0.032;g;60;kcal;NULL;NULL;NULL;NULL;NULL;NULL;NULL;NULL;NULL;NULL;NULL;NULL;NULL;NULL;['en:beverages', 'en:plant-based-milk-substitutes'];b
5,03886E+12;https://images.openfoodfacts.org/images/products/503/886/223/4115/front_fr.97.400.jpg;Super Smoothie Antioxydant;750 ml;150ml;Plastique,Bouteille en plastique;Innocent;['innocent'];NULL;Boissons,Jus de fruits,Jus de fruits frais;['en:plant-based-foods-and-beverages', 'en:beverages', 'en:plant-based-beverages', 'en:fruit-based-beverages', 'en:juices-and-nectars', 'en:fruit-juices', 'en:refrigerated-squeezed-juices'];Pas de canard en plastique,Pas de colorants,Pas de conservateurs,Pas de sucres ajoutés;['fr:pas-de-canard-en-plastique', 'fr:pas-de-colorants', 'fr:pas-de-conservateurs', 'fr:pas-de-sucres-ajoutes'];France;['en:france'];NULL;;[];100g;230;kJ;54;kcal;0.5;g;0.1;g;13;g;11;g;01.ian;g;0.5;g;0.1;g;0.04;g;230;kJ;18;mg;0.45;mg;NULL;NULL;NULL;NULL;NULL;NULL;NULL;NULL;NULL;NULL;['en:beverages', 'en:unsweetened-beverages'];c
3,22982E+12;https://images.openfoodfacts.org/images/products/322/982/078/3338/front.6.400.jpg;lait végétal épeautre noisette;1 l;NULL;Plastic, Tetra Pak, Brick, Container, TetraBrik Aseptic, fr:Brique en carton;Bjorg;['bjorg'];NULL;Aliments et boissons à base de végétaux, Boissons, Aliments d'origine végétale, Céréales et pommes de terre, Céréales et dérivés, Fruits à coques et dérivés, Boissons à base de végétaux, Substitut du lait, Boissons végétales, Boissons multivégétaux, Boissons sans sucre ajouté;['en:plant-based-foods-and-beverages', 'en:beverages', 'en:plant-based-foods', 'en:cereals-and-potatoes', 'en:cereals-and-their-products', 'en:nuts-and-their-products', 'en:plant-based-beverages', 'en:milk-substitute', 'en:plant-milks', 'en:mixed-plant-milks', 'en:unsweetened-beverages'];"Bio, Végétarien, Bio européen, Agriculture non UE, Végétalien, Agriculture UE, Agriculture UE/Non UE, en:FSC, FSC Mix, Point Vert, IT-BIO-006, IT-BIO-007, Fabriqué en Italie, Sans sucre ajouté, Nutriscore, Nutriscore B, AB Agriculture Biologique



";['en:organic', 'en:vegetarian', 'en:eu-organic', 'en:non-eu-agriculture', 'en:vegan', 'en:eu-agriculture', 'en:eu-non-eu-agriculture', 'en:fsc', 'en:fsc-mix', 'en:green-dot', 'en:it-bio-006', 'en:it-bio-007', 'en:made-in-italy', 'en:no-added-sugar', 'en:nutriscore', 'en:nutriscore-grade-b', 'fr:ab-agriculture-biologique'];France;['en:france'];water, spelt 7%, rice 6%, hazelnut 3%, oats 2,2%, cold-pressed sunflower oil, sea salt, organic ingredients,;en:gluten,en:nuts;['en:gluten', 'en:nuts'];100g;NULL;NULL;72;kcal;03.feb;g;0.3;g;10;g;05.feb;g;0.5;g;0.7;g;0.06;g;0.024;g;72;kcal;NULL;NULL;NULL;NULL;NULL;NULL;NULL;NULL;NULL;NULL;NULL;NULL;NULL;NULL;['en:beverages', 'en:plant-based-milk-substitutes'];b
8,8863E+12;https://images.openfoodfacts.org/images/products/888/630/321/0238/front_en.98.400.jpg;Lait de coco;200 ml;200g;Pot, Brick, Container, fr:Briquette en carton;Kara;['kara'];NULL;Plant-based foods and beverages, Beverages, Plant-based beverages, Milk substitute, Plant milks, Non-Alcoholic beverages, Coconut milks, Unsweetened beverages;['en:plant-based-foods-and-beverages', 'en:beverages', 'en:plant-based-beverages', 'en:milk-substitute', 'en:plant-milks', 'en:non-alcoholic-beverages', 'en:coconut-milks', 'en:unsweetened-beverages'];"Kosher, FSC
";['en:kosher', 'en:fsc'];France,Switzerland;['en:france', 'en:switzerland'];fresh coconut extract (64%), water, thickeners (xanthan gum, guar gum and carrageenan);;[];100g;NULL;NULL;249;kcal;18;g;17;g;02.sept;g;02.iun;g;0;g;02.ian;g;0.03;g;0.012;g;249;kcal;NULL;NULL;NULL;NULL;NULL;NULL;NULL;NULL;NULL;NULL;NULL;NULL;NULL;NULL;['en:beverages', 'en:plant-based-milk-substitutes'];d
3,22982E+12;https://images.openfoodfacts.org/images/products/322/982/078/0979/front_fr.135.400.jpg;Lait coco;1 L;NULL;Plastique, Tetra Pak, Brique, Carton, Brique en carton;Bjorg;['bjorg'];NULL;Plant-based foods and beverages,Beverages,Plant-based beverages,Milk substitute,Plant milks,Coconut milks,Sweetened beverages;['en:plant-based-foods-and-beverages', 'en:beverages', 'en:plant-based-beverages', 'en:milk-substitute', 'en:plant-milks', 'en:coconut-milks', 'en:sweetened-beverages'];Organic,EU Organic,Non-EU Agriculture,100% vegetable,Green Dot,IT-BIO-006,IT-BIO-007,Made in Italy,Nutriscore,Nutriscore Grade B,AB Agriculture Biologique;['en:organic', 'en:eu-organic', 'en:non-eu-agriculture', 'en:100-vegetable', 'en:green-dot', 'en:it-bio-006', 'en:it-bio-007', 'en:made-in-italy', 'en:nutriscore', 'en:nutriscore-grade-b', 'fr:ab-agriculture-biologique'];France;['en:france'];;;[];100g;NULL;NULL;24;kcal;01.iun;g;01.apr;g;02.apr;g;02.ian;g;NULL;NULL;0.5;g;0.09;g;0.036;g;24;kcal;NULL;NULL;NULL;NULL;NULL;NULL;NULL;NULL;NULL;NULL;NULL;NULL;NULL;NULL;['en:beverages', 'en:plant-based-milk-substitutes'];b
1,2001E+12;https://images.openfoodfacts.org/images/products/120/010/146/6562/front_en.111.400.jpg;Ocean Spray Cranberry Classique;1.25 l;200ml;Recycler, Bouteille, 30 % de RPET, Bouteille 30 % RPET, Bouteille en plastique recyclé;Ocean Spray;['ocean-spray'];NULL;Aliments et boissons à base de végétaux,Boissons,Boissons à base de végétaux,Boissons à la canneberge;['en:plant-based-foods-and-beverages', 'en:beverages', 'en:plant-based-beverages', 'en:fruit-based-beverages', 'en:beverages-with-cranberry'];Sans arômes artificiels,Arômes naturels,Sans colorants,Sans conservateurs;['en:no-artificial-flavors', 'en:natural-flavors', 'en:no-colorings', 'en:no-preservatives'];France;['en:france'];Eau, jus de cranberry à base de concentré 27%, sucre, vitamine C, carotte, cranberry, arôme naturel;;[];100g;167;kJ;39;kcal;0;g;0;g;09.mar;g;09.mar;g;NULL;NULL;0;g;0;g;0;g;167;kJ;0.012;mg;NULL;NULL;NULL;NULL;NULL;NULL;NULL;NULL;NULL;NULL;NULL;NULL;['en:beverages', 'en:sweetened-beverages'];e
3,12448E+12;https://images.openfoodfacts.org/images/products/312/448/018/4344/front_fr.91.400.jpg;Orangina;33 cl  (Can-Slim);serving;Canette métal recyclabbe à l'infini,Cannette aluminium;Orangina,Orangina Schweppes France,Schweppes International Limited;['orangina', 'orangina-schweppes-france', 'schweppes-international-limited'];NULL;Aliments et boissons à base de végétaux,Boissons,Boissons à base de végétaux,Boissons gazeuses,Boissons aux fruits,Sodas,Sodas aux fruits,Boissons sans alcool,Sodas à l'orange,Boissons avec sucre ajouté;['en:plant-based-foods-and-beverages', 'en:beverages', 'en:plant-based-beverages', 'en:carbonated-drinks', 'en:fruit-based-beverages', 'en:sodas', 'en:fruit-sodas', 'en:non-alcoholic-beverages', 'en:orange-soft-drinks', 'en:sweetened-beverages'];Sans arômes artificiels,Point Vert,Sans colorants,Canette métal à recycler;['en:no-artificial-flavors', 'en:green-dot', 'en:no-colorings', 'fr:canette-metal-a-recycler'];Belgique,France;['en:belgium', 'en:france'];carbonated water, orange juice and other citrus fruits made from concentrates 12% (orange 10%, lemon, tangerine, grapefruit), sugar, pulp 2% (orange, tangerine), orange zest extract, natural orange aromas,;;[];100g;174;kJ;41;kcal;0.1;g;0;g;09.iul;g;09.iun;g;NULL;NULL;0.1;g;0.02;g;0.008;g;174;kJ;NULL;NULL;NULL;NULL;NULL;NULL;NULL;NULL;NULL;NULL;NULL;NULL;NULL;NULL;['en:beverages', 'en:sweetened-beverages'];e
3,50211E+12;https://images.openfoodfacts.org/images/products/350/211/000/3201/front_fr.115.400.jpg;Tropicana Multivitamines 1 L;1000 ml;150 ml;Bouteille, Bouteille en plastique, Bouteille et bouchon à recycler, Bouteille plastique 01 (PET);Tropicana;['tropicana'];NULL;Aliments et boissons à base de végétaux, Boissons, Boissons à base de végétaux, Boissons aux fruits, Jus et nectars, Jus de fruits, Jus multifruits;['en:plant-based-foods-and-beverages', 'en:beverages', 'en:plant-based-beverages', 'en:fruit-based-beverages', 'en:juices-and-nectars', 'en:fruit-juices', 'en:multifruit-juices'];Peu ou pas de sucre, Point Vert, Sans sucre ajouté, Sans conservateurs, Info-tri-point-vert;['en:low-or-no-sugar', 'en:green-dot', 'en:no-added-sugar', 'en:no-preservatives', 'fr:info-tri-point-vert'];France,Italie;['en:france', 'en:italy'];juices and fruit purees (orange, apple, white grape, pineapple, passion fruit, apricot, banana, mango, peach, guava, pear, lemon), vitamins c, e, b6, b2, b1 and provitamin a;;[];100g;204;kJ;48;kcal;0;g;0;g;12;g;10.iul;g;0;g;0;g;0;g;0;g;204;kJ;54;mg;0.39;mg;NULL;NULL;NULL;NULL;NULL;NULL;NULL;NULL;NULL;NULL;['en:beverages', 'en:unsweetened-beverages'];c
