code;image_url;product_name;quantity;serving_size;packaging;brands;brands_tags;brand_owner;categories;categories_tags;labels;labels_tags;countries;countries_tags;ingredients_text_en;allergens;allergens_tags;nutrition_data_per;energy_kj_value;enerkj_unit;energy_kcal_value;energy_kcal_unit;fat_value;fat_unit;saturated_fat_value;saturated_fat_unit;carbohydrates_value;carbohydrates_unit;sugars_value;sugars_unit;fiber_value;fiber_unit;proteins_value;proteins_unit;salt_value;salt_unit;sodium_value;sodium_unit;energy_value;energy_unit;vitamin_c_value;vitamin_c_unit;vitamin_b6_value;vitamin_b6_unit;vitamin_b12_value;vitamin_b12_unit;potassium_value;potassium_unit;calcium_value;calcium_unit;caffeine_value;caffeine_unit;taurine_value;taurine_unit;food_groups_tags;nutriscore_grade
4,00236E+12;https://images.openfoodfacts.org/images/products/400/235/900/6715/front_fr.71.400.jpg;Lait de coco;200 ml;50 ml;Tetra Pak, Brique, Carton;Suzi Wan;['suzi-wan'];NULL;Aliments et boissons à base de végétaux, Boissons, Boissons à base de végétaux, Substitut du lait, Boissons végétales, Laits de coco, Boissons sans sucre ajouté;['en:plant-based-foods-and-beverages', 'en:beverages', 'en:plant-based-beverages', 'en:milk-substitute', 'en:plant-milks', 'en:coconut-milks', 'en:unsweetened-beverages'];Point Vert, Sans conservateur artificiel, Sans colorants, Sans exhausteur de goût;['en:no-artificial-preservatives', 'en:green-dot', 'en:no-colorings', 'en:no-flavour-enhancer'];France,Italie,Suisse;['en:france', 'en:italy', 'en:switzerland'];NULL;;[];100g;NULL;NULL;169;kcal;17;g;14.apr;g;01.sept;g;0.6;g;1;g;2;g;0.04;g;0.016;g;169;kcal;NULL;NULL;NULL;NULL;NULL;NULL;NULL;NULL;NULL;NULL;NULL;NULL;NULL;NULL;['en:beverages', 'en:plant-based-milk-substitutes'];c
3,12335E+12;https://images.openfoodfacts.org/images/products/312/334/901/1227/front_en.55.400.jpg;LE PUR JUS Orange sans pulpe;1 L;100ml;Bouteille en plastique;Joker;['joker'];NULL;Aliments et boissons à base de végétaux, Boissons, Boissons à base de végétaux, Boissons aux fruits, Jus et nectars, Jus de fruits, Jus d'orange, Jus de fruits pur jus, Jus d'orange pur jus;['en:plant-based-foods-and-beverages', 'en:beverages', 'en:plant-based-beverages', 'en:fruit-based-beverages', 'en:juices-and-nectars', 'en:fruit-juices', 'en:orange-juices', 'en:squeezed-juices', 'en:squeezed-orange-juices'];Fabriqué en France, Sans sucre ajouté, Nutriscore, Nutriscore C;['en:made-in-france', 'en:no-added-sugar', 'en:nutriscore', 'en:nutriscore-grade-c'];France;['en:france'];fr: orange juice, see gb: orange juice,;;[];100g;186;kJ;42;kcal;0;g;0;g;08.iun;g;08.iun;g;NULL;NULL;0.6;g;0.01;g;0.004;g;186;kJ;0.02;mg;NULL;NULL;NULL;NULL;NULL;NULL;NULL;NULL;NULL;NULL;NULL;NULL;['en:beverages', 'en:unsweetened-beverages'];c
3,22982E+12;https://images.openfoodfacts.org/images/products/322/982/079/3689/front_fr.124.400.jpg;Soja vanille;1 L;NULL;Tetra Pak, Brique, Carton, Brique en carton, Film plastique à jeter;Bjorg;['bjorg'];NULL;Aliments et boissons à base de végétaux, Boissons, Aliments d'origine végétale, Légumineuses et dérivés, Boissons à base de végétaux, Substitut du lait, Boissons végétales, Boissons végétales de légumineuses, Boissons végétales de soja, Boissons avec sucre ajouté, Boissons végétales de soja à la vanille;['en:plant-based-foods-and-beverages', 'en:beverages', 'en:plant-based-foods', 'en:legumes-and-their-products', 'en:plant-based-beverages', 'en:milk-substitute', 'en:plant-milks', 'en:legume-milks', 'en:soy-milks', 'en:sweetened-beverages', 'en:vanilla-soy-milks'];Bio, Bio européen, Agriculture non UE, Agriculture UE, Agriculture UE/Non UE, IT-BIO-006, IT-BIO-007, Fabriqué en Italie, Sans OGM, Nutriscore, Nutriscore A, AB Agriculture Biologique;['en:organic', 'en:eu-organic', 'en:it-bio-006', 'en:it-bio-007', 'en:nutriscore', 'en:nutriscore-grade-a', 'fr:ab-agriculture-biologique', 'en:agriculture-ue', 'en:agriculture-ue-non-ue', 'en:agriculture-non-ue', 'en:bio', 'en:bio-europeen', 'en:fabrique-en-italie', 'en:sans-ogm'];France;['en:france'];tonyu* (water, soy beans * non-gmo hulled 7,6 %), cane sugar* blond, natural aroma of vanilla, marine algae lithothamnium calcareum, sea salt*,;en:soybeans;['en:soybeans'];100g;NULL;NULL;52;kcal;02.mar;g;0.4;g;4;g;03.iun;g;01.ian;g;03.mar;g;0.08;g;0.032;g;52;kcal;NULL;NULL;NULL;NULL;NULL;NULL;NULL;NULL;0.12;mg;NULL;NULL;NULL;NULL;['en:beverages', 'en:plant-based-milk-substitutes'];a
5,03886E+12;https://images.openfoodfacts.org/images/products/503/886/216/6508/front_fr.97.400.jpg;Innocent jus ananas & fruit de la passion 900ml;900 ml;200ml;Frais, Bouchon plastique, Bouteille en plastique, Bouteille plastique;Innocent;['innocent'];NULL;Aliments et boissons à base de végétaux, Boissons, Boissons à base de végétaux, Frais, Boissons aux fruits, Jus et nectars, Jus de fruits, Boissons sans alcool, Jus multifruits, Jus de fruits pur jus, Jus multifruits pur jus;['en:plant-based-foods-and-beverages', 'en:beverages', 'en:plant-based-beverages', 'en:fresh-foods', 'en:fruit-based-beverages', 'en:juices-and-nectars', 'en:fruit-juices', 'en:non-alcoholic-beverages', 'en:multifruit-juices', 'en:squeezed-juices', 'en:squeezed-multifruit-juices'];"en:FSC, en:fsc-c095196, FSC Mix, Point Vert
";['en:fsc', 'en:fsc-mix', 'en:green-dot', 'en:fsc-c095196'];France,Suisse,en:france;['en:france', 'en:switzerland'];NULL;;[];100g;187;kj;44;kcal;0;g;0;g;10;g;08.sept;g;0.4;g;0.4;g;0;g;0;g;187;kj;24;mg;NULL;NULL;NULL;NULL;NULL;NULL;NULL;NULL;NULL;NULL;NULL;NULL;['en:beverages', 'en:unsweetened-beverages'];c
