code;image_url;product_name;quantity;serving_size;packaging;brands;brands_tags;brand_owner;categories;categories_tags;labels;labels_tags;countries;countries_tags;ingredients_text_en;allergens;allergens_tags;nutrition_data_per;energy_kj_value;enerkj_unit;energy_kcal_value;energy_kcal_unit;fat_value;fat_unit;saturated_fat_value;saturated_fat_unit;carbohydrates_value;carbohydrates_unit;sugars_value;sugars_unit;fiber_value;fiber_unit;proteins_value;proteins_unit;salt_value;salt_unit;sodium_value;sodium_unit;energy_value;energy_unit;vitamin_c_value;vitamin_c_unit;vitamin_b6_value;vitamin_b6_unit;vitamin_b12_value;vitamin_b12_unit;potassium_value;potassium_unit;calcium_value;calcium_unit;caffeine_value;caffeine_unit;taurine_value;taurine_unit;food_groups_tags;nutriscore_grade
3,27869E+12;https://images.openfoodfacts.org/images/products/327/869/350/4076/front_fr.78.400.jpg;Emprésuré au chocolat;4*125 g;125g;Pot, Container;Malo;['malo'];NULL;Dairies, Desserts, Fermented foods, Fermented milk products, Dairy desserts, Dessert creams, Yogurts, Chocolate desserts, Refrigerated dessert creams, Refrigerated chocolate custard dessert, fr:laits-empresures-au-chocolat, Yaourts aromatisés;['en:beverages', 'en:dairies', 'en:desserts', 'en:fermented-foods', 'en:fermented-milk-products', 'en:dairy-drinks', 'en:milks', 'en:dairy-desserts', 'en:flavoured-milks', 'en:dessert-creams', 'en:yogurts', 'en:chocolate-desserts', 'en:flavoured-yogurts', 'en:refrigerated-dessert-creams', 'en:renneted-milks', 'en:flavoured-renneted-milks', 'en:refrigerated-chocolate-custard-dessert', 'fr:laits-empresures-au-chocolat'];en:Lait Français, en:Point Vert, en:Produit en Bretagne;['en:lait-francais', 'en:point-vert', 'en:produit-en-bretagne'];France,en:france;['en:france'];partially skimmed pasteurized milk 64%, skimed condensed milk, sugar 11%, cocoa 2,4%, chocolate 1%: cocoa paste and cocoa butter, renuret, calcium chloride;en:milk;['en:milk'];100g;470;kJ;111;kcal;01.aug;g;01.ian;g;18;g;18;g;0;g;05.iul;g;0.22;g;0.088;g;470;kJ;NULL;NULL;NULL;NULL;NULL;NULL;NULL;NULL;220;mg;NULL;NULL;NULL;NULL;['en:milk-and-dairy-products', 'en:milk-and-yogurt'];b
3,03349E+12;https://images.openfoodfacts.org/images/products/303/349/121/4509/front_en.57.400.jpg;Actimel 0%;800 g;NULL;Plastique,Bouteille,Frais,Etui en carton;Danone,Actimel;['danone', 'actimel'];NULL;Boissons,Produits laitiers,Produits fermentés,Produits laitiers fermentés,Boissons lactées,Boissons édulcorées,Boissons fermentées,Boissons lactées fermentées,Yaourts,Yaourts à boire,Boissons sans sucre ajouté,Yaourts à boire sans sucres;['en:beverages', 'en:dairies', 'en:fermented-foods', 'en:fermented-milk-products', 'en:dairy-drinks', 'en:artificially-sweetened-beverages', 'en:fermented-drinks', 'en:fermented-milk-drinks', 'en:yogurts', 'en:drinkable-yogurts', 'en:unsweetened-beverages', 'fr:yaourts-a-boire-sans-sucres'];Peu ou pas de matière grasse,Peu ou pas de sucre,Peu de sucre,Allégé en sucre,Contient une source de phénylalanine,Point Vert,Sans matière grasse,Nutriscore,Nutriscore A;['en:low-or-no-fat', 'en:low-or-no-sugar', 'en:low-sugar', 'en:reduced-sugar', 'en:contains-a-source-of-phenylalanine', 'en:green-dot', 'en:no-fat', 'en:nutriscore', 'en:nutriscore-grade-a'];Belgique,France,Allemagne,Espagne;['en:belgium', 'en:france', 'en:germany', 'en:spain'];skimmed milk, reconstituted skimmed milk, water, dextrose (0,6%), thickener (pectin), milk mineral concentrate, sweeteners (aspartame, acesulfame k), lactic ferments including lactobacillus casei (milk), vitamin b6, natural flavor, vitamin d, contains a source of phenylalanine,;en:milk;['en:milk'];100g;115;kJ;27;kcal;8;g;0.11;g;12;g;1;g;0;g;02.iul;g;0.1;g;0.04;g;115;kJ;NULL;NULL;0.21;mg;NULL;NULL;NULL;NULL;NULL;NULL;NULL;NULL;NULL;NULL;['en:beverages', 'en:sweetened-beverages'];c
3,17657E+12;https://images.openfoodfacts.org/images/products/317/657/174/4289/front_en.90.400.jpg;Candy'Up Goût Chocolat;1,2 L (6*20 cl);20cl;Tetra Pak,Brique,Récipient,Briquette,Film plastique;Candia;['candia'];NULL;Boissons,Produits laitiers,Boissons lactées,Laits aromatisés,Laits aromatisés au chocolat;['en:beverages', 'en:dairies', 'en:dairy-drinks', 'en:flavoured-milks', 'en:chocolate-milks'];Sans colorants,Sans conservateurs,Nutriscore,Nutriscore B;['en:no-colorings', 'en:no-preservatives', 'en:nutriscore', 'en:nutriscore-grade-b'];Belgique,France,Espagne;['en:belgium', 'en:france', 'en:spain'];Dairy products: 93% (partly skimmed milk, reconstituted milk permeate), sugar, cocoa 1.4%, vitamin D.;en:milk;['en:milk'];100g;263;kJ;62;kcal;0.9;g;0.6;g;10;g;09.iul;g;0.6;g;03.feb;g;0.09;g;0.036;g;263;kJ;NULL;NULL;NULL;NULL;NULL;NULL;NULL;NULL;100;mg;NULL;NULL;NULL;NULL;['en:milk-and-dairy-products', 'en:milk-and-yogurt'];b
8,43655E+12;https://images.openfoodfacts.org/images/products/843/654/777/0137/front_en.51.400.jpg;Natural Kéfir;500 g;NULL;Plastic,Pot,Producto;Hacendado;['hacendado'];NULL;Beverages,Dairies,Fermented foods,Fermented milk products,Dairy drinks,Fermented drinks,Fermented milk drinks,Kefir;['en:beverages', 'en:dairies', 'en:fermented-foods', 'en:fermented-milk-products', 'en:dairy-drinks', 'en:fermented-drinks', 'en:fermented-milk-drinks', 'en:kefir'];;[];Spain;['en:spain'];Leche, nata, leche en polvo desnatada y fermentos;en:milk;['en:milk'];100g;308;kJ;74;kcal;04.feb;g;02.sept;g;05.ian;g;02.mar;g;NULL;NULL;03.sept;g;0.1;g;0.04;g;308;kJ;NULL;NULL;NULL;NULL;NULL;NULL;NULL;NULL;NULL;NULL;NULL;NULL;NULL;NULL;['en:beverages', 'en:unsweetened-beverages'];e
3,32978E+12;https://images.openfoodfacts.org/images/products/332/977/816/4019/front_fr.64.400.jpg;P'tit Yop, Goût Fraise;180 g;180g;Frais, Bouteille et bouchon plastique à recycler;Yoplait;['yoplait'];NULL;Boissons, Produits laitiers, Produits fermentés, Produits laitiers fermentés, Boissons lactées, Frais, Boissons fermentées, Boissons lactées fermentées, Yaourts, Yaourts à boire, Yaourts aromatisés, Yaourts à boire goût fraise;['en:beverages', 'en:dairies', 'en:fermented-foods', 'en:fermented-milk-products', 'en:dairy-drinks', 'en:fresh-foods', 'en:fermented-drinks', 'en:fermented-milk-drinks', 'en:yogurts', 'en:drinkable-yogurts', 'en:flavoured-yogurts', 'en:strawberry-yogurt-drinks'];Point Vert, Arômes naturels, Eco-emballages, Info-tri-point-vert, Se-conserve-jusqu-a-8-h-hors-du-frigo;['en:green-dot', 'en:natural-flavors', 'fr:eco-emballages', 'fr:info-tri-point-vert', 'fr:se-conserve-jusqu-a-8-h-hors-du-frigo'];Belgique,France;['en:belgium', 'en:france'];NULL;en:milk;['en:milk'];100g;277;kJ;65;kcal;0.8;g;0.5;g;10.iun;g;10.mai;g;0.1;g;3;g;0.12;g;0.048;g;277;kJ;0.75;mg;NULL;NULL;NULL;NULL;NULL;NULL;120;mg;NULL;NULL;NULL;NULL;['en:beverages', 'en:sweetened-beverages'];e
3,32977E+12;https://images.openfoodfacts.org/images/products/332/977/004/7891/front_fr.96.400.jpg;Mini Yop Fraise;100 g;100 g;Plastique, Bouteille, Bouchon de bouteille, Bouchon de bouteille de vin, Bouteille en plastique;Yoplait,Yop;['yoplait', 'yop'];NULL;Boissons, Produits laitiers, Produits fermentés, Produits laitiers fermentés, Boissons lactées, Boissons fermentées, Boissons lactées fermentées, Yaourts, Yaourts à boire, Yaourts aromatisés, Yaourts à boire goût fraise, Boissons avec sucre ajouté;['en:beverages', 'en:dairies', 'en:fermented-foods', 'en:fermented-milk-products', 'en:dairy-drinks', 'en:fermented-drinks', 'en:fermented-milk-drinks', 'en:yogurts', 'en:drinkable-yogurts', 'en:flavoured-yogurts', 'en:strawberry-yogurt-drinks', 'en:sweetened-beverages'];Point Vert, Arômes naturels, Eco-Emballages, Se conserve jusqu'à 8 H hors du frigo;['en:green-dot', 'en:natural-flavors', 'fr:eco-emballages', 'fr:se-conserve-jusqu-a-8-h-hors-du-frigo'];Belgique,France,Suisse;['en:belgium', 'en:france', 'en:switzerland'];partially skimmed milk made from milk powder - sugar 6% - glucose-fructose syrup 3.8% - natural aroma - concentrated milk minerals - lactic ferments (milk),;en:milk;['en:milk'];100g;NULL;NULL;65;kcal;0.8;g;0.8;g;10.iun;g;10.mai;g;0.1;g;3;g;0.12;g;0.048;g;65;kcal;NULL;NULL;NULL;NULL;NULL;NULL;NULL;NULL;120;mg;NULL;NULL;NULL;NULL;['en:beverages', 'en:sweetened-beverages'];e
3,32977E+12;https://images.openfoodfacts.org/images/products/332/977/006/3297/front_fr.48.400.jpg;YOP Parfum Vanille;825 g;170 g (recommandée);Plastique, Bouteille, Flacon, Bouteille en plastique;Yoplait, Yop gf;['yoplait', 'yop-gf'];NULL;Boissons, Produits laitiers, Produits fermentés, Produits laitiers fermentés, Boissons lactées, Boissons fermentées, Boissons lactées fermentées, Yaourts, Yaourts à boire, Yaourts à boire goût vanille;['en:beverages', 'en:dairies', 'en:fermented-foods', 'en:fermented-milk-products', 'en:dairy-drinks', 'en:fermented-drinks', 'en:fermented-milk-drinks', 'en:yogurts', 'en:drinkable-yogurts', 'en:vanilla-yogurt-drinks'];Sans colorants;['en:no-colorings'];France;['en:france'];NULL;en:milk;['en:milk'];100g;279;kJ;66;kcal;0.8;g;0.5;g;10.iul;g;10.mai;g;NULL;NULL;3;g;0.12;g;0.048;g;279;kJ;NULL;NULL;NULL;NULL;NULL;NULL;NULL;NULL;120;mg;NULL;NULL;NULL;NULL;['en:beverages', 'en:sweetened-beverages'];e
4,0255E+12;https://images.openfoodfacts.org/images/products/402/550/018/6821/front_xx.94.400.jpg;;500g;NULL;Plastic,PP;Müller;['muller'];NULL;Beverages,Dairies,Fermented foods,Fermented milk products,Dairy drinks,Fermented drinks,Fermented milk drinks,Kefir;['en:beverages', 'en:dairies', 'en:fermented-foods', 'en:fermented-milk-products', 'en:dairy-drinks', 'en:fermented-drinks', 'en:fermented-milk-drinks', 'en:kefir'];;[];Luxembourg,Deutschland,Frankreich,Rumänien,Spanien;['en:luxembourg', 'en:deutschland', 'en:frankreich', 'en:rumanien', 'en:spanien'];;en:milk;['en:milk'];100g;193;kJ;46;kcal;01.mai;g;1;g;04.ian;g;04.ian;g;0;g;03.apr;g;0.12;g;0.048;g;193;kJ;NULL;NULL;NULL;NULL;NULL;NULL;NULL;NULL;NULL;NULL;NULL;NULL;NULL;NULL;['en:milk-and-dairy-products', 'en:milk-and-yogurt'];d
3,03349E+12;https://images.openfoodfacts.org/images/products/303/349/121/3205/front_fr.85.400.jpg;Actimel;12 x 100 g;100g;Bouteille;Danone,Actimel;['danone', 'actimel'];NULL;Bebidas,Lácteos,Comidas fermentadas,Productos fermentados de la leche,Bebida lácteas,Bebidas fermentadas,Bebidas de leche fermentada,Yogures,Yogures para beber,Bebidas no azucaradas;['en:beverages', 'en:dairies', 'en:fermented-foods', 'en:fermented-milk-products', 'en:dairy-drinks', 'en:fermented-drinks', 'en:fermented-milk-drinks', 'en:yogurts', 'en:drinkable-yogurts', 'en:unsweetened-beverages'];Sin colorantes,Sin conservantes;['en:no-colorings', 'en:no-preservatives'];Afganistán,Francia,Alemania,España;['en:afghanistan', 'en:france', 'en:germany', 'en:spain'];fermented milk with lactobacillus casei, sugar (7.3%), dextrose (0.6%), vitamins d and b6,;en:milk;['en:milk'];100g;NULL;NULL;73;kcal;01.iun;g;1;g;10.aug;g;10.aug;g;NULL;NULL;3;g;0.1;g;0.04;g;73;kcal;NULL;NULL;0.21;mg;NULL;NULL;NULL;NULL;120;mg;NULL;NULL;NULL;NULL;['en:beverages', 'en:sweetened-beverages'];e
3,66151E+12;https://images.openfoodfacts.org/images/products/366/150/508/6530/front_fr.24.400.jpg;DANAO PÊCHE ABRICOT;900 ml;NULL;Frais, Bouchon plastique, Bouteille plastique, Opercule aluminium;Danao;['danao'];NULL;Aliments et boissons à base de végétaux, Boissons, Aliments d'origine végétale, Produits laitiers, Aliments à base de fruits et de légumes, Petit-déjeuners, Boissons à base de végétaux, Boissons lactées, Boissons aux fruits, Boissons au lait et au jus de fruits;['en:plant-based-foods-and-beverages', 'en:beverages', 'en:plant-based-foods', 'en:dairies', 'en:fruits-and-vegetables-based-foods', 'en:breakfasts', 'en:plant-based-beverages', 'en:dairy-drinks', 'en:fruit-based-beverages', 'en:fruit-and-milk-beverages'];Sans arômes artificiels, Agriculture non UE, Pommes de France, Agriculture UE, Agriculture UE/Non UE, Lait Français, Point Vert, Fabriqué en France, Sans sucre ajouté, Sans colorants artificiels, Sans conservateurs, Riche en vitamine A, Riche en vitamine E, 50 % plastique recyclé;['en:no-artificial-flavors', 'en:non-eu-agriculture', 'en:apples-from-france', 'en:eu-agriculture', 'en:eu-non-eu-agriculture', 'en:french-milk', 'en:green-dot', 'en:made-in-france', 'en:no-added-sugar', 'en:no-artificial-colors', 'en:no-preservatives', 'en:rich-in-vitamin-a', 'en:rich-in-vitamin-e', 'fr:50-plastique-recycle'];France,Suisse;['en:france', 'en:switzerland'];NULL;en:milk;['en:milk'];100g;NULL;NULL;43;kcal;0.1;g;0;g;09.mar;g;08.iul;g;NULL;NULL;0.8;g;0;g;0;g;43;kcal;NULL;NULL;NULL;NULL;NULL;NULL;NULL;NULL;NULL;NULL;NULL;NULL;NULL;NULL;['en:beverages', 'en:unsweetened-beverages'];d
3,32978E+12;https://images.openfoodfacts.org/images/products/332/977/816/4064/front_fr.87.400.jpg;Yop parfum vanille;720 g (4 x 180 g);180g;Plastique, Bouteille, Bouchon de bouteille, Carton, Frais, Étui, Bouchon de bouteille de vin;Yoplait;['yoplait'];NULL;Boissons, Produits laitiers, Produits fermentés, Produits laitiers fermentés, Boissons lactées, Frais, Boissons fermentées, Boissons lactées fermentées, Yaourts, Yaourts à boire, Yaourts aromatisés, Boissons avec sucre ajouté, Yaourts à boire goût vanille;['en:beverages', 'en:dairies', 'en:fermented-foods', 'en:fermented-milk-products', 'en:dairy-drinks', 'en:fresh-foods', 'en:fermented-drinks', 'en:fermented-milk-drinks', 'en:yogurts', 'en:drinkable-yogurts', 'en:flavoured-yogurts', 'en:sweetened-beverages', 'en:vanilla-yogurt-drinks'];Sans gluten, Lait Français, Arômes naturels, Se-conserve-jusqu-a-8-h-hors-du-frigo;['en:no-gluten', 'en:french-milk', 'en:natural-flavors', 'fr:se-conserve-jusqu-a-8-h-hors-du-frigo'];France;['en:france'];NULL;en:milk;['en:milk'];100g;NULL;NULL;66;kcal;0.8;g;0.5;g;10.iul;g;10.mai;g;0.1;g;3;g;0.1;g;0.04;g;66;kcal;NULL;NULL;NULL;NULL;NULL;NULL;NULL;NULL;120;mg;NULL;NULL;NULL;NULL;['en:beverages', 'en:sweetened-beverages'];b
7,61303E+12;https://images.openfoodfacts.org/images/products/761/303/316/2220/front_fr.167.400.jpg;Dolce Gusto Nesquik;256 g;166 g;Plastique, Bouchon de bouteille, Boîte, Capsule, Carton, Dose invididuelle, Bouchon de bouteille de vin, 21;Nescafé,Nescafé Dolce Gusto, Dolce gusto;['nescafe', 'nescafe-dolce-gusto', 'dolce-gusto'];NULL;Aliments et boissons à base de végétaux, Boissons, Aliments d'origine végétale, Snacks, Produits laitiers, Snacks sucrés, Petit-déjeuners, Cacao et dérivés, Boissons chaudes, Boissons lactées, Produits déshydratés, Produits lyophilisés à reconstituer, Cacaos et chocolats en poudre, Cafés, Boissons instantanées, Dosettes, Chocolats en poudre, Cafés en dosettes, Cafés en dosettes compatible Dolce Gusto, Dosettes Dolce Gusto;['en:plant-based-foods-and-beverages', 'en:beverages', 'en:plant-based-foods', 'en:snacks', 'en:dairies', 'en:sweet-snacks', 'en:breakfasts', 'en:cocoa-and-its-products', 'en:hot-beverages', 'en:dairy-drinks', 'en:dried-products', 'en:dried-products-to-be-rehydrated', 'en:cocoa-and-chocolate-powders', 'en:coffees', 'en:instant-beverages', 'en:capsules', 'en:chocolate-powders', 'en:coffee-capsules', 'en:dolce-gusto-compatible-coffee-capsules', 'fr:dosettes-dolce-gusto'];Point Vert, Hecho en España, Sin gluten, Triman;['en:green-dot', 'fr:triman', 'fr:hecho-en-espana', 'fr:sin-gluten'];Francia,España,Suiza, en:martinique, en:france;['en:france', 'en:martinique', 'en:spain', 'fr:francia', 'fr:suiza'];whole milk powder (46.8%), sugar, lean cocoa (10.6%), milk skimmed powder (2.7%), lactose, vegetable fat (coconut), natural aromas, mineral salts (calcium carbonate), emulsifier (soja lecithin), salt, yeast extract, vitamins (thiamine, niacin, pantothenic acid, b6, folic acid), cinnamon,;en:milk,en:soybeans;['en:milk', 'en:soybeans'];100g;1833;kJ;436;kcal;15.aug;g;10.feb;g;56.1;g;54.2;g;03.mar;g;15.aug;g;0.7;g;0.28;g;1833;kJ;75;mg;01.apr;mg;NULL;NULL;NULL;NULL;767;mg;NULL;NULL;NULL;NULL;['en:milk-and-dairy-products', 'en:milk-and-yogurt'];e
3,32978E+12;https://images.openfoodfacts.org/images/products/332/977/816/4026/front_fr.85.400.jpg;Hop parfum framboise;180 g;180g;Plastique, Bouteille;Yoplait;['yoplait'];NULL;Boissons, Produits laitiers, Produits fermentés, Produits laitiers fermentés, Boissons lactées, Boissons fermentées, Boissons lactées fermentées, Yaourts, Yaourts à boire;['en:beverages', 'en:dairies', 'en:fermented-foods', 'en:fermented-milk-products', 'en:dairy-drinks', 'en:fermented-drinks', 'en:fermented-milk-drinks', 'en:yogurts', 'en:drinkable-yogurts'];Lait Français;['en:french-milk'];France;['en:france'];NULL;en:milk;['en:milk'];100g;NULL;NULL;66;kcal;0.8;g;0.5;g;10.iul;g;10.mai;g;0.1;g;3;g;0.12;g;0.048;g;66;kcal;NULL;NULL;NULL;NULL;NULL;NULL;NULL;NULL;120;mg;NULL;NULL;NULL;NULL;['en:beverages', 'en:sweetened-beverages'];b
3,17657E+12;https://images.openfoodfacts.org/images/products/317/657/174/4012/front_fr.36.400.jpg;Candy'Up goût Fraise;1,2 L (6x20cL);200 ml;Plastique, Tetra Pak, Brique, Carton, Film, Paquet;Candy up,Candy'Up,Candia;['candy-up', 'candy-up', 'candia'];NULL;Boissons, Produits laitiers, Boissons lactées, Laits aromatisés, Boissons avec sucre ajouté;['en:beverages', 'en:dairies', 'en:dairy-drinks', 'en:flavoured-milks', 'en:sweetened-beverages'];Fabriqué en France;['en:made-in-france'];France;['en:france'];NULL;;['en:milk'];100g;NULL;NULL;57;kcal;0.6;g;0.4;g;10;g;09.iul;g;0;g;3;g;0.09;g;0.036;g;57;kcal;NULL;NULL;NULL;NULL;NULL;NULL;NULL;NULL;100;mg;NULL;NULL;NULL;NULL;['en:beverages', 'en:sweetened-beverages'];e
3,32977E+12;https://images.openfoodfacts.org/images/products/332/977/006/3273/front_fr.4.400.jpg;Yaourt à boire sucré aromatisé;825 g;170 g (recommandée);Plastique, Bouteille, Bouteille en plastique;Yoplait,Yop;['yoplait', 'yop'];NULL;Boissons,Produits laitiers,Produits fermentés,Produits laitiers fermentés,Boissons lactées,Boissons fermentées,Boissons lactées fermentées,Yaourts,Yaourts à boire,Yaourts à boire goût fraise;['en:beverages', 'en:dairies', 'en:fermented-foods', 'en:fermented-milk-products', 'en:dairy-drinks', 'en:fermented-drinks', 'en:fermented-milk-drinks', 'en:yogurts', 'en:drinkable-yogurts', 'en:strawberry-yogurt-drinks'];Lait Français,Triman;['en:french-milk', 'fr:triman'];France;['en:france'];skimmed milk based on milk powder - sugar 7,9% - creameer - natural aroma - concentrate of milk minerals - lactic ferments (milk) - vitamin d, milk of origin france,;en:milk;['en:milk'];100g;277;kJ;65;kcal;0.8;g;0.5;g;10.iun;g;10.mai;g;NULL;NULL;3;g;0.12;g;0.048;g;277;kJ;NULL;NULL;NULL;NULL;NULL;NULL;NULL;NULL;120;mg;NULL;NULL;NULL;NULL;['en:beverages', 'en:sweetened-beverages'];e
3,03349E+12;https://images.openfoodfacts.org/images/products/303/349/121/3212/front_fr.59.400.jpg;Actimel Gout Multi Fruits;8 x 100 g;NULL;Métal, Plastique, PEHD - Polyéthylène haute densité, en:Recyclable Metals, Aluminium, Carton;Danone;['danone'];NULL;Boissons, Produits laitiers, Produits fermentés, Produits laitiers fermentés, Boissons lactées, Boissons fermentées, Boissons lactées fermentées, Yaourts, Yaourts à boire, Yaourts aromatisés, Yaourts aux fruits, Yaourt au lait fermenté aux fruits avec édulcorants à 0% de matières grasses enrichi en vitamine D, Yaourt au lait fermenté avec édulcorants à 0% de matières grasses;['en:beverages', 'en:dairies', 'en:fermented-foods', 'en:fermented-milk-products', 'en:dairy-drinks', 'en:fermented-drinks', 'en:fermented-milk-drinks', 'en:yogurts', 'en:drinkable-yogurts', 'en:flavoured-yogurts', 'en:fruit-yogurts', 'en:fat-free-fermented-milk-yogurt-with-fruits-and-sweetener-fortified-with-vitamin-d', 'en:fat-free-flavoured-fermented-milk-yogurt-with-sweetener'];Nutriscore, Nutriscore B;['en:nutriscore', 'en:nutriscore-grade-b'];Frankreich,Deutschland;['en:france', 'en:germany'];NULL;;[];100g;334;kJ;79;kcal;01.mai;g;1;g;12.iul;g;12.mai;g;NULL;NULL;02.aug;g;0.1;g;0.04;g;334;kJ;NULL;NULL;0.21;mg;NULL;NULL;NULL;NULL;120;mg;NULL;NULL;NULL;NULL;['en:beverages', 'en:sweetened-beverages'];e
3,66151E+12;https://images.openfoodfacts.org/images/products/366/150/508/6578/front_en.6.400.jpg;DANAO ORANGE BANANE FRAISE;900 ml;NULL;Bouteille;Danao;['danao'];NULL;Aliments et boissons à base de végétaux, Boissons, Produits laitiers, Boissons à base de végétaux, Boissons lactées, Boissons aux fruits, Boissons au lait et au jus de fruits, Lactes;['en:plant-based-foods-and-beverages', 'en:beverages', 'en:dairies', 'en:plant-based-beverages', 'en:dairy-drinks', 'en:fruit-based-beverages', 'en:fruit-and-milk-beverages', 'fr:lactes'];Sans arômes artificiels, Sans sucre ajouté, Sans colorants artificiels, Sans colorants ni arômes artificiels, Sans conservateurs;['en:no-artificial-flavors', 'en:no-added-sugar', 'en:no-artificial-colors', 'en:no-artificial-colours-or-flavours', 'en:no-preservatives'];France;['en:france'];;en:milk;['en:milk'];100g;NULL;NULL;38;kcal;0.1;g;0;g;08.feb;g;07.sept;g;NULL;NULL;0.8;g;0;g;0;g;38;kcal;24;µg;NULL;NULL;NULL;NULL;NULL;NULL;NULL;NULL;NULL;NULL;NULL;NULL;['en:beverages', 'en:unsweetened-beverages'];d
3,18155E+12;https://images.openfoodfacts.org/images/products/318/155/000/0126/front_fr.50.400.jpg;Boisson au lait aromatisé cacao canette 25 cl;25 cl;25 cl;Métal, Boîte de conserve ou canette, Canette;Cacolac;['cacolac'];NULL;Boissons, Produits laitiers, Boissons lactées, Laits aromatisés, Laits aromatisés au chocolat, Boissons avec sucre ajouté;['en:beverages', 'en:dairies', 'en:dairy-drinks', 'en:flavoured-milks', 'en:chocolate-milks', 'en:sweetened-beverages'];Point Vert, Fabriqué en France;['en:green-dot', 'en:made-in-france'];Belgique,France;['en:belgium', 'en:france'];NULL;en:milk;['en:milk'];100g;275;kJ;65;kcal;1;g;0.5;g;11;g;11;g;NULL;NULL;3;g;0.13;g;0.052;g;275;kJ;NULL;NULL;NULL;NULL;NULL;NULL;NULL;NULL;120;mg;NULL;NULL;NULL;NULL;['en:beverages', 'en:sweetened-beverages'];b
3,03349E+12;https://images.openfoodfacts.org/images/products/303/349/146/0845/front_fr.53.400.jpg;Actimel sans sucres ajoutés;600 g (6 x 100 g);100g;Plastique, PEHD - Polyéthylène haute densité, Carton;Danone;['danone'];NULL;Boissons, Produits laitiers, Produits fermentés, Produits laitiers fermentés, Boissons lactées, Boissons fermentées, Boissons lactées fermentées, Yaourts, Yaourts à boire;['en:beverages', 'en:dairies', 'en:fermented-foods', 'en:fermented-milk-products', 'en:dairy-drinks', 'en:fermented-drinks', 'en:fermented-milk-drinks', 'en:yogurts', 'en:drinkable-yogurts'];Sans sucre ajouté, Nutriscore, Nutriscore A;['en:nutriscore', 'en:nutriscore-grade-a', 'en:sans-sucre-ajoute'];Francja;['en:france'];NULL;;['en:milk'];100g;NULL;NULL;45;kcal;01.iun;g;0.9;g;4;g;4;g;0;g;03.iun;g;0;g;0;g;45;kcal;NULL;NULL;0.21;mg;NULL;NULL;NULL;NULL;120;mg;NULL;NULL;NULL;NULL;['en:beverages', 'en:unsweetened-beverages'];d
3,32977E+12;https://images.openfoodfacts.org/images/products/332/977/006/2375/front_fr.43.400.jpg;Spécialité laitière sucrée aromatisée enrichie en calcium et vitamine D;444 g;100g;Plastique, Carton, Frais;Yoplait,Petits filous tub's;['yoplait', 'petits-filous-tub-s'];NULL;Boissons, Produits laitiers, Desserts, Produits fermentés, Produits laitiers fermentés, Fromages, Boissons lactées, Desserts lactés, Boissons fermentées, Boissons lactées fermentées, Yaourts, Yaourts à boire, Quark, Fromages blancs, Fromages à la crème;['en:beverages', 'en:dairies', 'en:desserts', 'en:fermented-foods', 'en:fermented-milk-products', 'en:cheeses', 'en:dairy-drinks', 'en:dairy-desserts', 'en:fermented-drinks', 'en:fermented-milk-drinks', 'en:yogurts', 'en:drinkable-yogurts', 'en:quark', 'fr:fromages-blancs', 'en:cream-cheeses'];Lait Français, Point Vert;['en:french-milk', 'en:green-dot'];France;['en:france'];NULL;en:milk;['en:milk'];100g;285;kJ;67;kcal;2;g;01.mar;g;9;g;08.ian;g;0.1;g;02.iul;g;0.11;g;0.044;g;285;kJ;NULL;NULL;NULL;NULL;NULL;NULL;NULL;NULL;0.00012;mg;NULL;NULL;NULL;NULL;['en:beverages', 'en:sweetened-beverages'];e
5,71195E+12;https://images.openfoodfacts.org/images/products/571/195/300/7828/front_fr.46.400.jpg;Starbucks Cappuccino;220 ml;100ml;Plastique, Carton, UHT;Starbucks;['starbucks'];NULL;Boissons, Produits laitiers, Boissons lactées, Laits aromatisés, Laits aromatisés au chocolat, Cappuccino;['en:beverages', 'en:dairies', 'en:dairy-drinks', 'en:flavoured-milks', 'en:chocolate-milks', 'fr:cappuccino'];"Commerce équitable, Fairtrade International

";['en:fair-trade', 'en:fairtrade-international'];Belgique,France, en:spain, en:luxembourg;['en:belgium', 'en:france', 'en:luxembourg', 'en:spain'];NULL;en:milk;['en:milk'];100g;NULL;NULL;69;kcal;02.mai;g;01.iun;g;08.aug;g;08.mai;g;NULL;NULL;02.iul;g;0.08;g;0.032;g;69;kcal;NULL;NULL;NULL;NULL;NULL;NULL;NULL;NULL;NULL;NULL;NULL;NULL;NULL;NULL;['en:beverages', 'en:sweetened-beverages'];e
3,76012E+12;https://images.openfoodfacts.org/images/products/376/012/296/0749/front_fr.38.400.jpg;Vache à boire;500 ml;NULL;Plastique, Bouteille, Bouchon de bouteille, Frais, Bouchon de bouteille de vin;Michel et Augustin,Michel et Augustin les trublions du goût;['michel-et-augustin', 'michel-et-augustin-les-trublions-du-gout'];NULL;Boissons,Produits laitiers,Produits fermentés,Produits laitiers fermentés,Boissons lactées,Frais,Boissons fermentées,Boissons lactées fermentées,Yaourts,Yaourts à boire,Boissons sans sucre ajouté,Yaourts à boire goût vanille;['en:beverages', 'en:dairies', 'en:fermented-foods', 'en:fermented-milk-products', 'en:dairy-drinks', 'en:fresh-foods', 'en:fermented-drinks', 'en:fermented-milk-drinks', 'en:yogurts', 'en:drinkable-yogurts', 'en:unsweetened-beverages', 'en:vanilla-yogurt-drinks'];Point Vert,Concocté en France,Eco-Emballages;['en:green-dot', 'fr:concocte-en-france', 'fr:eco-emballages'];France;['en:france'];NULL;en:milk;['en:milk'];100g;NULL;NULL;82;kcal;03.ian;g;2;g;11;g;10;g;NULL;NULL;02.iun;g;0.1;g;0.04;g;82;kcal;NULL;NULL;NULL;NULL;NULL;NULL;NULL;NULL;NULL;NULL;NULL;NULL;NULL;NULL;['en:beverages', 'en:unsweetened-beverages'];e
